english,korean
painstaking,근면한; 노고를 아끼지 않는, 공들인, 수고, 근면
panacea,만병 통치약
pandemonium,대혼란, 혼돈, 지옥, 아수라장; 복마전
paralysis,무기력, 무능, 마비, 불수; 중풍, 정체, 마비상태
paramount,최고의; 주요한; 탁월한; 훌륭한, 최고 권력을 쥔, 최고 권위자; 군주
paraphrase,바꾸어 말하다, 의역하다, 의역
parcel,분할하다, 꾸러미, 소포
parenthesis,소괄호; 삽화, 여담
parlor,응접실, 객실, 거실
parody,패러디, 풍자 섞인 개작; 서투른 모방
parsimony,지나친 절약; 인색
partake,참여하다, 함께하다
patent,명백한, 분명한; 특허의, 특허, 특허권; 독특한 것; 특징
pathetic,측은한, 불쌍한, 정서적인, 감상적인; 감동적인, 얼마 안 되는, 비애, 애수
pattern,도안, 무늬; 행동 양식; 같은 일의 반복; 모범, 귀감; 견본
paycheck,급료지불수표
peaceful,평온한, 조용한; 평화적인
peak,정점, 절정; 성수기; 할증 요금, 최고의, 절정인
penniless,무일푼의, 빈털터리의
pensive,생각에 잠긴, 곰곰이 생각하는, 시름(우수)에 젖은
perfunctory,마지못해 하는, 형식적인; 기계적인, 열의가 없는, 무관심한
peril,위험, 위난, 위험에 빠뜨리다, 목숨을 걸다
periodical,정기 간행물, 잡지
periphery,(정치의)소수파, 야당(the~), 주변, 주위; 교외, 원주, 바깥둘레; 표면
perish,죽다, 멸망하다, 소멸하다, 붕괴하다
perjury,위증; 위증죄
permeation,침투, 삼투, 녹아 들어감
personnel,직원, 사원; 총인원; 인사부
perspicuous,명쾌한, 명료한
pertinent,적절한, 딱 들어맞는; 관련된; ~에 속하는
pervasive,널리 퍼지는; 보급력이 있는
petrify,돌처럼 굳게 하다; 석질로 만들다, 경직시키다, 망연자실(하게) 하다
pharmaceutical(s),제약의, 약
philosopher,철학자; 철인, 현인
picturesque,그림같이 아름다운, 회화적인; 생생한
pinnacle,정상, 꼭대기; 정점, 절정; 뾰족탑
pinpoint,핀 끝; 하찮은 것; 조금, 소량, 정확하게 지적하다; 정밀 폭격하다
pioneer,(새 분야를) 개척하다; 도로를 개설하다, 개척자, 선구자, 개척자의, 선구적인
pit,겨루게 하다, 경쟁시키다; 싸움을 붙이다; 구멍, 구덩이; 함정이
pitch in,열심히 하기 시작하다; 서로 협력하다; 참여하다
pittance,약간의 수당; 소량, 소수
pivotal,중추적인, 중요한, 회전축의
placate,달래다, 위로하다, 진정시키다
placid,평온한, 잔잔한, 조용한, 차분한, 자기 만족의
plagiarism,표절, 도용; 표절 행위, 표절물
plain,명백한, 분명한; 평이한, 간단한; 솔직한; 평범한, 단조로운; 못생긴
platonic,관념적인, 정신적인; 정신적 연애를 하는
plausible,그럴듯한, 정말 같은 말재주 있는
plea,청원, 기도; 변명, 구실
plead,변호하다, 항변하다, 변명하다; 탄원하다, 간청하다
pleasing,유쾌한, 마음에 드는, 기분 좋은, 붙임성 있는
pledge,맹세, 서약; 담보, 저당; 보증, 맹세하다; 보증하다; 저당잡히다
plentiful,풍부한, 많은
plight,곤경, 궁지, 상태, 맹세; 약혼, 맹세하다; 약혼시키다
plunge,떨어뜨리다, 던져 넣다, 내던지다; 뛰어 들다; 떨어지다
poise,균형 잡히다, 균형 잡히게 하다; 자세를 취하다
polish,닦다, 윤내다; 세련되게 하다; 윤이 나다, 광택, 윤; 우아, 품위
politic,분별 있는, 자각 있는; 교묘한; 술책을 부리는, 정치적 역학관계
poll,투표, 투표수, 투표 결과; 여론 조사, 여론 조사를 하다, 투표하다
pore,응시하다, 주목하다; 골똘히 생각하다
porosity,구멍; 다공성
portable,들고 다닐 수 있는, 휴대용의, 간편한, 휴대용 기구, 포터블
porter,짐꾼; 운반인; 청소부; 문지기, 수위
portion,부분; 몫, 분배 재산; 1인분, 분할하다, 분배하다
portray,묘사하다; 그리다; 역을 맡다
posthumous,사후의, 사후에 생긴, 저자의 사후 출판된; 유복자인
posture,자세; 몸가짐; 마음가짐, 자세를 취하게 하다; ~인 체하다, 배치하다
potent,강력한, 유력한, 힘센; 영향력이 있는; 효력이 있는
pound,마구 치다, 난타하다; 문을 두드리다; 빻다
pragmatic,실용적인, 실용주의의
praiseworthy,칭찬할 만한, 훌륭한
preach,설교하다, 훈계하다; 전도하다, 설교, 강론
precarious,불확실한, 운에 맡기는; 위험한, 근거가 박약한, 확고하지 못한
precedent,선례, 전례; 관례; 판례, 이전의; 선행하는, 앞선
precipitate,마구 재촉하다, 촉진시키다, 거꾸로 떨어뜨리다, 서두르다, 참전하다, 다급한, 돌진하는
precise,정확한, 정밀한; 명확한, 딱 들어맞는, 까다로운, 꼼꼼한
predicament,곤경, 궁지
predicate,입각하다, 근거를 두다, 단정(단언)하다, 암시하다; 내포하다, 단정하는, 술어; 속성
prejudice,편견, 선입관; 편애, 편파, 손해, 불이익, 편견을 갖게 하다
premeditated,미리 계획된, 계획적인
premium,할증금, 프리미엄, 장려금, 보험료, 할부금, 사례금, 특히 우수한, 값비싼
preposterous,앞뒤가 뒤바뀐, 비상식적인, 불합리한
prerogative,특권, 특전; 대권, 특권을 가진
prescription,처방(전); 처방약, 규정, 명령, 지시, 법규, (법률) 시효
presence,존재, 실재; 출석, 참석; 풍채, 인품, 태도
prestige,명성, 위신, 세력, 명문의, 일류의
presume,가정하다, 상상하다, ~이라고 여기다, 감히 ~하다, 가정하다; 참견하다; 버릇없이 ~하다
presumptuous,주제넘은, 건방진, 뻔뻔스러운
presuppose,~을 전제로 하다; 미리 예상하다
pretend,가장하다, ~인 체하다, 사칭하다
prevail,유행하다, 보급되다, 널리 퍼지다, 우세하다, 압도하다; 이기다
prevalent,일반적으로 행하여지는, 유행하는, 우세한, 유력한
prime,준비시키다; 미리 알려주다, 제1의; 주요한, 으뜸가는, 최고의, 전성기; 초기, 봄
prior,이전의, 앞의, ~보다 앞선, ~보다 중요한, 우선하는
pristine,원시적인, 옛날의; 오염되지 않은, 순박한
prized,중요한, 높이 평가받는, 가치 있는
proceed,나아가다, 가다; 속행하다, 계속하다, 법적 절차를 밟다, 처리하다, 유래하다, 보수, 수익금
procrastinate,늑장부리다, 꾸물거리다, 미루다, 연기하다
procure,마련하다, 조달하다; 획득하다
profound,깊은; 심원한; 난해한, 마음에서 우러나는, 충심의, 뿌리깊은, 심연; 심해; 깊은 곳
progenitor,선구자, 창시자, 원죠; 선배; 원본, 선조, 조상
prohibitively,엄두도 못낼 만큼, 엄청나게
projecting,돌출한, 툭 튀어나온, 뻐드렁니
proletariat,무산계급, 최하층민
proliferation,급증; 확산
prolific,다산의, 열매를 많이 맺는, 비옥한
prolong,연장하다; 늘이다
promote,증진하다, 진척시키다, 장려하다; 고무하다; 조장하다, 승진시키다, 촉진하다
prompt,재빠른, 기민한, 즉시의, 즉석의, 자극하다, 상기시키다, 대사를 일러주다, 정확히, 정각에
prone,~하는 경향이 있는
proof,증거; 시험, 테스트
propaganda,선전, 선전 운동
prophetic,예언적인
prosaic,무미건조한, 재미없는; 활기없는, 지루한, 산문체의
prospect,전망, 조망, 경치, 예상, 기대; 가망, 조사하다, 답사하다; 시굴하다
prosperous,번영하는; 순조로운, 유리한
protagonist,주인공, 주역; 주창자; 리더, 지도자
protect,보호하다
protest,항의하다, 이의를 제기하다; 지불을 거절하다; 주장하다
protocol,외교 의례, 의정서, 조약안; 실험계획안; 프로토콜
proverb,속담, 격언; 금언, 교훈
provided,만약 ~이라면
prowess,훌륭한 솜씨, 용감, 용맹; 용감한 행위
proxy,대리, 대리권; 대리 행위, 대리 투표; 위임장
prudent,조심성있는; 신중한; 사려깊은, 분별있는, 타산적인, 알뜰한
psyche,영혼, 정신, 프시케, 심리학, 정신적으로 혼란시키다, 불안하게 하다
puberty,사춘기, 성숙기
publish,발표하다, 공표하다; 출판하다, 발행하다
punctual,시간을 잘 지키는, ~에 늦지 않는, 규칙적인; 정확한
punitive,형벌의, 징벌의; 가혹한
purchase,얻다, 획득하다; 사다, 구매, 구입; 취득, 획득
purpose,목적, 의도; 취지, 논점, 의도하다, 결심하다
putative,추정되고 있는, 소문에 들리는
quay,부두, 선창
questionable,의심스러운, 미심쩍은
quietly,조용히, 평온하게; 은밀하게
radiant,빛나는, 반짝이는, 밝은; 방사되는
ragged,초라한, 남루한; 기진맥진한, 지친
rampant,(식물이)만연하는, 무성한, 우거진, 유행하는, 마구 퍼지는, 사나운, 광포한, 과격한
rancid,썩은 냄새가 나는; 악취가 나는, 불쾌한, 역겨운
random,마구잡이의, 무작위의, 닥치는 대로의
rapidly,급속히, 빨리
ratify,인가하다; 비준하다, 실증하다, 확증하다
ravel,얽히게 하다, 헝클다; 복잡해지다
raw,가공하지 않은, 날것의, 천연 그대로의; 미숙한; 거친, 세련되지 않은
raze,파괴하다, 무너뜨리다
reach,구역, 범위; 팔이 미치는 범위; 세력 범위
reaffirm,재차 단언하다
realistic,현실주의의, 실제적인, 진짜 같은; 사실주의의
reap,수확하다; 획득하다
rear,기르다, 부양하다; 재배하다, 세우다, 일으키다, 뒤, 배후; 뒷부분, 후미
reasonable,이치에 맞는, 논리적인, 합리적인; 적당한, 합당한
rebellious,반항하는; 반체제의; 반란하는, 낫기 힘든, 난치의, 다루기 힘든, 힘에 부치는
rebuke,비난하다, 꾸짖다, 비난, 힐책
recall,상기하다, 생각해 내다; 연상시키다, 취소하다, 회수하다, 기억력, 상기, 철회, 회수
recess,일시적인 휴식; 휴가, 휴회, 휴정, 후미진 곳, 깊은 곳, 우묵한 곳에 놓다, 휴회하다
reckless,무모한, 부주의한
reclaim,개간하다; 메우다, 간척하다, 교정하다, 이용하다, 재생하다, 길들이다, 교정, 교화
reconcile,화해시키다, 융화시키다; 조화시키다, 중재하다, 스스로 체념케 하다
recount,자세히 말하다, 이야기하다; 열거하다, 다시 세다, 재계산하다; 재계표
recuperate,회복하다, 만회하다
recurring,되풀이해서 일어나는, 회ㅜ기하는
redeem,교환하다, 환전하다, 상푸으로 바꾸다, 되찾다, 상환하다, 벌충하다, 죄로부터 구하다
redress,보상, 배상; 시정, 교정, 바로잡다, 제거하다, 배상하다, 덜다, 시정하다
redundant,여분의, 과다한; 풍부한, 남아도는, 말이 많은, 장황한, 군더더기의, 불필요하게 된
reengineering,조직 재충전, 리엔지니어링
reexamine,재검토하다, 재시험하다, 재심문하다
refined,세련된, 품위 있는, 우아한, 교묘한, 정제된
refrain,그만두다; 삼가다, 자제하다, 후렴, 반복구
refresh,원기를 회복시키다, 활기를 주다, 새롭게 하다; 상쾌해지다
refrigerate,냉각시키다, 냉동하다; 얼다
refute,논박하다, 반박하다, 그릇됨을 증명하다
regional,지역의; 특정 지방의; 국부의
regretful,뉘우치는, 슬퍼하는, 서운해하는
rehearse,예행연습을 하다, 시연하다; 암송하다; 열거하다
reimburse,상환하다, 변제하다, 변상하다
reiterate,되풀이하다, 반복하다
rejuvenate,원기를 회복하다, 다시 젊어지(게 하)다
release,석방하다, 해방하다; 방출하다, 면제하다; 개봉하다; 폭탄을 투하하다, 석방, 방출, 발매, 개봉
relegate,내쫓다, 추방하다; 좌천시키다, 이관하다, 위탁하다, 분류시키다
relevant,관련된; 적절한, 타당한, 상당하는
reliable,믿을 수 있는, 의지가 되는, 확실한
relinquish,그만두다, 버리다, 포기하다; 양도하다
reluctant,마음 내키지 않는; 마지못해 하는
remainder,나머지, 잔여
remarkable,주목할 만한, 두드러진; 비범한
remit,보내다, 송금하다, 용서하다; 면제하다, 늦추다, 완화하다, 하급법원으로 이송하다
remnant,찌꺼기, 잔여, 자투리; 잔존물, 유적
remote,먼, 멀리 떨어진, 원격의; 외딴, 관계가 먼, 원격조작의
remuneration,보수, 보상; 급여
rend,째다, 찢다; 분열시키다; 쪼개지다, 분열하다
render,~가 되게 하다; 주다; 보답하다; 제출하다; 교부하다; ~을 표현하다, 묘사하다; 연주하다
renown,명성, 위신, 세력, 명문의, 일류의
repay,갚다, 상환하다
repeal,무효로 하다, 폐지(폐기)하다, 폐지, 폐기; 취소, 철회
repent,후회하다, 회개하다
replay,경기를 다시하다, 재연하다, 재생하다
replenish,다시 채우다, 보충하다, 사람으로 가득 채우다
report,보고, 보고서; 기사, 보도, 보고하다, 보도하다, 기록하다
represent,상징하다, 의미하다; 묘사하다, 표현하다, 대표하다, 대리하다; 상상하다
reprimand,꾸짖다, 질책하다; 견책하다, 견책, 징계; 비난, 질책
repugnant,싫은, 불쾌한; 모순된, 양립할 수 없는
requisite,필요한, 필수의, 없어서는 안될, 필수품, 필요물, 필요조건
research,조사하다, 연구하다, 학술연구, 학술조사, 탐구, 조사
resemble,닮다
resentment,분개, 분노, 원한; 적의
reserve,남겨두다, 보존하다, 확보하다, 보유하다, 예약해두다, 준비금, 적립금; 보류, 유보
reset,눈금을 고쳐 놓다; 리셋하다
resolve,결심하다; 결의하다, 의결하다, 풀다, 해결하다, 자연치유하다, 결심, 결의; 결단력
resort,의지하다, 도움을 청하다; 자주 드나들다, 행락지; 의지, 의뢰
resource,자원, 공급원, 물자; 수단, 방편; 재능, 소질
respect,존경, 경의; 존중, 중시; 주의, 관심, 고려, 인사, 문안, 점, 사항, 존경하다, 유의하다
restrain,억제하다, 누르다, 구속하다, 제지하다, 단념시키다
resume,다시 시작하다, 재개하다; 요약하다
resurrection,부활, 부흥; 그리스도의 부활
resuscitation,소생, 부활
retain,보유하다, 유지하다, 존속시키다, 마음에 간직하다, 잊지 않다, 고용하다
retaliate,보복하다, 앙갚음하다, 보복 과세하다
retirement,은퇴, 퇴직, 퇴역; 연금; 은거
retract,취소하다, 철회하다, 오므리다, 움츠리다; 물러서다
retrieve,되찾다, 회수하다; 만회하다, 회복하다, 갱생시키다, 구하다, 구출하다
retrospect,회고하다, 추억에 잠기다, 회상, 회고; 추억
reveal,드러내다, 폭로하다, 비밀을 누설하다
revenue,세입; 수익, 수입, 총수입, 재원, 국세청, 세무서
reverse,역, 반대; 뒤, 배후; 불운, 실패, 거구로의, 단대의, 역전시키다; 번복하다
revision,개정, 교정, 수정, 정정, 수정한 것; 개정판, 복습
revitalize,생기를 회복시키다, 소생시키다; 활력을 불어 넣다
revival,재생, 부활
revolve,회전하다, 돌다, 공전하다; 순환하다
revulsion,강한 혐오감, 반감, 격변, 급변, 되돌리기, 잡아떼기
reward,보수, 보상; 현상금, 사례금; 보답, 응보, 벌; 이익, 보답하다, 보상하다; 보복하다
ridicule,비웃다, 조롱하다, 조롱, 비웃음
rife,유행하는, 자자한; 가득찬, 수없이 많은
rigidly,엄격하게, 완고하게
rip-off,도둑질, 강탈; 사기; 사취, 도둑질하다; 사취하다
risky,위험한, 모험적인; 아슬아슬한
roam,돌아다니다, 거닐다, 배회하다; 방랑하다, 돌아다님, 산책, 배회
roar,고함치다; 으르렁거리다
robust,강건한, 건장한, 튼튼한, 강한, 확고한, 힘이 드는, 인내를 요하는, 거친, 난폭한
role,역할, 기능, 배역
rooted,뿌리 깊은, 정착한, 자리에 얼어붙은
roster,명부, 근무 명부; 등록 멤버
rotate,회전하다; 교대하다, 교대시키다; 순환시키다
rotten,썩은, 부패한, 타락한
rough,울퉁불퉁한; 거친, 난폭한; 서투른
rouse,깨우다, 깨다; 고무하다, 분발시키다
row,열, 줄, 배를 젖다, 노를 저어가다, 노젓기, 법석, 소동, 떠들썩함; 싸움, 말다툼; 싸우다
rudimentary,원리의, 기본의, 기초의, 미 발달의, 형성기의; 발육 부진의
rugged,울퉁불퉁한, 바위투성이의; 거친; 난폭한; 고된
rupture,파열, 균열; 결렬, 단절, 탈장, 파열하다, 단절하다
sadistic,가학적인
sagacious,현명한, 영리한, 슬기로운
salutary,유익한, 건전한, 건강에 좋은, 몸에 좋은
salvage,구출; 인명구조; 해난구조, 구출하다; 인양하다, 이용하다
sanction,재가, 인가, 시인; 허용, 찬성, 도덕적 구속력, 제재, 처벌, 인가하다, 시인하다
sanguine,붉은, 혈색이 좋은, 명랑한; 낙천적인, 붉은색; 다혈질
sap,약화시키다, 밑을 파서 무너뜨리다, 수액을 짜내다, 활력을 잃게 하다, 수액, 생기, 호
satellite,위성; 인공위성; 위성방송, 인공위성의; 종속된
scant,부족한, 빈약한, 적은, 아까워하다, 인색하게 굴다, 경시하다, 아껴서; 간신히, 가까스로
scarce,부족한, 모자라는; 드문, 진귀한
scold,꾸짖다, 잔소리하다
score,얻다, 득점하다, 채점하다; 성공을 거두다; ~보다 뛰어나다, 악보, 악곡, 득점, 사실, 진상
scorn,경멸, 모욕, 냉소, 경멸하다, 멸시하다
scour,탐색하다, 찾아 다니다, 문질러 닦다, 윤내다
scrape,문지르다, 닦다, 긁어내다; 근근이 살아가다
screen,방충망; 체, 여과기; 스크린, ~이 ~을 가리다; 차단하다; 지키다, 비호하다
scrub,문지르다, 세척하다; 연기하다, 취소하다; 해고하다, 작은 나무, 쓸모없는 사람; 제2군
scruple,망설임; 양심의 가책, 주저하다; 양심의 가책을 느끼다
scrutinize,세밀히 조사하다, 철저히 검사하다
seasoning,양념, 조미료; 흥취
sect,분파, 종파, 학파, 파벌
secular,이승의, 속세의, 현세의, 비종교적인, 교구 사제; 속인
sedative,진정제, 진정의; 진정시키는
seemly,알맞은, 적당한; 품위 있는, 점잖은, 품위 있게; 알맞게
seep,스며 나오다, 새다; 침투하다, 퍼지다
segregate,격리하다, 분리하다, 차별 대우를 하다
seize,붙잡다, 꽉 쥐다, 움켜잡다; 이해하다, 체포하다; 빼앗다, 강탈하다, 덮치다; 압류하다
selfmade,자력으로 입신 출세한; 자기가 만든; 자작의
semblance,외관, 외형, 모습; 유사함
sensational,선풍적 인기의, 세상을 놀라게 하는; 선동적인, 자극적인; 선정적인; 눈부신, 두드러진
sensitive,감수성이 예민한, 섬세한; 민감한, 신경 과민의, 신경질적인, 변동을 잘 하는, 불안정한
sentient,감각력이 있는; 의식하는, 감각이 있는 사람
series,일련, 연속; 시리즈, 연속물
servitude,노예, 노예 상태, 예속
setback,(진보 등의) 방해; 좌절; 패배, 실패, 역행, 퇴보, 후퇴, 역수, 역류
settle,놓다, 설치하다, 살게 하다, 가라앉히다, 해결하다, 결정하다, 확정하다, 지불하다
shabby,초라한, 허름한, 지저분한; 낡아빠진
shatter,산산이 부수다, 박살내다; 흩뿌리다, 파편, 조각; 파손, 분쇄
shed,흘리다; 벗다, 탈피하다; (빛 등을) 발하다
sheer,완전한, 순전한; 순수한, 얇은, 올 사이가 비쳐 보이는, 깎아지른 듯한, 가파른, 수직으로
shelter,피난처; 임시 수용소; 방공호, 보호하다, 숨겨주다
shield,보호하다, 감싸다, 숨기다, 은폐하다, 방패, 보호물
shipment,선적, 수송; 뱃짐
short0sighted,근시안적인
shortage,부족, 결핍
short-lived,단명하는, 단기간의; 일시적인, 덧없는
shortly,곧; 간단히; 무뚝뚝하게
shred,찢다, 조각, 단편; 아주 조금
shrewd,영리한, 날카로운; 빈틈없는, 재빠른
shrink,줄어들다, 움츠러들다, 겁내다; 줄이다, 축소시키다
sibling,형제, 자매
simultaneously,동시에; 일제히
sinister,불길한, 재수없는; 재앙이 되는, 악의가 있는, 사악한, 왼쪽의
sizable,상당한 크기의, 꽤 큰
skeleton,골격; 해골; 뼈대, 골자, 개략; 본질적인 부분
skeptical,의심 많은; 회의적인
skillful,숙련된, 능숙한; 잘 만들어진
skim,대충(대강) 읽다, 스쳐가다, 미끄러지듯 나아가다, 걷어 내다
skip,깡충 뛰다, 까불다; 건너 뛰다; 띄엄띄엄 읽다
slack,느려지다, 게을리하다, 느슨한, 늘어진; 부주의한, 느린, 굼뜬, 꾸물거리는, 불경기의
slander,중상, 욕설; 구두 명예 훼손, 중상하다, ~의 명예를 훼손하다
slope,경사, 기울기; 경기 후퇴, 경사지다, 비탈지다
slovenly,부주의한, 단정치 못한, 게으른
sluggish,느린, 완만한, 게으름 피우는, 나태한
smother,숨이 막히게 하다; 질식시키다, 덮어 끄다, 묻어 두다, 억누르다, 짙은 연기, 농무
smuggle,밀수입하다, 밀수하다, 밀입국하다, 밀항하다; 은닉하다
snatch,와락 붙잡다, 잡아채다, 강탈하다, 빼앗다; 유괴하다, 잡아챔; 조각, 단편
sober,술 취하지 않은, 맑은 정신의, 절제하는, 침착한, 얌전한, 진지한; ~의 술을 깨게 하다
sociable,사교적인, 붙임성 있는, 친목의
sojourn,묵다, 체류하다; 일시 체재하다, 체류, 체재
solemn,엄숙한, 진지한; 근엄한, 장엄한, 위엄을 부리는; 격식을 차린, 종교상의
solicit,간청하다, 요청하다; 권유하다, 부추기다, 손님을 끌다
solidify,굳히다, 굳어지다; 확고하게 하다, 응고시키다, 일치 단결시키다
sophisticated,세련된; 매우 복잡한, 정교한; 지나치게 기교적인; 약이빠진
sort,분류하다, 가려내다, 종류, 부류; 정렬
source,근원, 출처
span,한 뼘; 기간, 생존 기간, 눈대중하다; ~에 걸치다
spare,(시간 등을) 할애하다, 내주다; 절약하다, 아끼다; 용서하다, 여분의, 예비의; 결핍된
spark,불꽃이 튀다; 도화선이 되다, 야기하다, 유발하다, 불꽃, 섬광; 활기, 생기; 흔적, 기미
spatial,공간의, 장소의; 우주의
specific,명확한, 구체적인; 특정한, 특유한, 독특한, 특효있는; 특이한, 특성, 특질, 상세, 세부
spectacular,구경거리의; 장관인, 볼 만한, 극적인, 초대작; 대형 옥외 광고
speculate,사색하다, 깊이 생각하다, 추측하다, 투기하다, 투기 매매하다
spell,차례, 순번, 고대; 근무 시간, 한차례; 잠시 동안; 병의 발작, 교대하다, 주술, 주문
spinach,시금치, 필요 없는 것, 군더더기
spoil,망치다, 상하게 하다, 못쓰게 만들다, 응석을 받아주다, 상하다, 약탈품, 전리품, 관직
spontaneous,자연히 일어나는, 자발적인; 임의의, 자생의, 자연스러운
sporadic,때때로 일어나는, 산재하는, 드문드문한, 우발적인, 단발성의
spot,얼룩점, 반점, 점, 오점, 장소, 현장, 직위, 현지의, 얼룩이 생기다, 발견하다, 분별하다
sprain,삐다, 삠, 염좌
squalid,더러운, 불결한, 궁상스러운, 비열한, 치사스러운
staggering,혼비백산케 하는, 압도적인, 비틀거리는, 비틀거리게 하는, 망설이는
stagnant,정체된, 활기 없는, 불경기의
stale,싱싱하지 못한; 김빠진, 진부한, 케케묵은, 김빠지(게 하)다, 상하(게 하)다
stamina,지구력, 체력, 정력
standard,표준, 기준, 모범; 보통, 보통의, 무난한; 표준의, 표준 규격의
standing,상비의, 상임의; 불변의; 습관적인; 선 채로의, 신분, 지위; 명성
staple,요소; 원료, 재료, 주성분; 요강, 주요 산물; 중요 상품; 기본 식료품, 기본적인, 분류하다
stature,키, 신장; 사물의 높이, 지위나 명성, 중요성
stealthy,몰래 하는, 남의 눈을 피하는, 내밀의
stem,생기다, 일어나다, 유래하다, 줄기, 잎자루, 꽃자루, 열매 꼭지, 종족, 막다, 저지하다
stiff,딱딱한, 경직된; (목 등이) 뻐근한, 긴장된; 가혹한, 엄한; 매우 비싼
stigme,치욕, 오명; 오점, 증후, 증상, 반점; 흉터, 낙인
still,정지한, 조용한, 그럼에도 불구하고; 여전히, 증류하다
stipulate,규정하다, 조건으로 요구하다; 약정하다
stock,자본금, 주식, 공채; 재고품; 축적; 나무줄기; 혈통, 가계, 재고의, 주식의, 저장하다
store,따로 떼어두다, 비축하다, 공급하다
strain,잡아 당기다, 애쓰다, 반발하다, 긴장시키다, 무리하다, 곡해하다, 긴장, 피로, 혈통
strategic,전략의, 전략상의
stray,길을 잃다, 방황하다; 벗어나다, 이탈하다, 길 잃은, 헤매는, 방황하는, 길 잃은 사람
streamline,간소화하다, 현대화하다, 유선형의, 유선; 유선형
strenuous,분투적인, 불굴의, 굽히지 않는, 격렬한, 활발한; 정력적인
stricken,맞은, 상처받은; 비탄에 잠긴, 고통받는
striking,이목을 끄는, 두드러진; 인상적인
stringent,엄중한, 엄격한, 긴박한, 설득력이 있는
strive,노력하다, 애쓰다; 분투하다, 항쟁하다
struggle,싸우다, 격투하다; 분투하다, 애쓰다
stumble,비틀거리다, 더듬다, 죄를 짓다, 실수하다, 난처하게 하다, 비틀거림; 죄, 실수; 실패, 실책
stupid,어리석은, 우둔한; 무감각한, 화나게 하는
sturdy,튼튼한, 억센; 완강한, 불굴의
subliminal,의식되지 않는; 잠재의식의
submit,제출하다; 맡기다, 복종시키다, 복종하다; 따르다
subscribe,기부를 약속하다, 기부하다; 서명하다; 예약 구독하다
