english,korean
abandon,그만두다, 단념하다; 버리다, 떠나다
aberrant,정도를 벗어난, 탈선적인
abide,머무르다, 체재하다, 참다, 견디다; 저항하다
ability,능력, 재능, 수완, 역량
ablaze,밝은 빛으로 빛나는
aboard,배로; 승선하여, ~에 타고; 새로 가입하여
abolish,(법률,제도등을)폐지하다
abortive,실패한, 유산의, 사산의
abreast,나란히; ~와 병행하여
abridge,요약하다, 단축하다, 삭감하다
abrogate,폐지하다, 폐기하다, ~을 치우다, 그만두다, 끝내다
abruptly,갑자기, 불시에; 뜻밖에, 급격하게
abscond,몰래 도주하다, 종적을 감추다
absent,자리를 비운, 결석의 결근의(from); 결여된, 멍한
absorb,열중시키다, (시간, 주의등을) 빼앗다, 흡수 합병하다; 동화되다; 이민을 받아들이다
abstain,삼가다, 절제하다, 끊다(from), 기권하다, 회피하다
abstract,발췌, 요약, 적요; 추상적인, 이론적인, 관념적인
abstruse,난해한, 심오한
absurd,어리석은; 우스꽝스러운, 불합리한, 모순된; 부조리한, 부조리
abundant,풍부한, 많은; (자원등이)풍족한(in, on)
abuse,모욕하다, 욕하다, ~을 악용하다, 남용하다, 악용, 남용, 오용; 학대, 혹사
accept,받아들이다, 허락하다, 순응하다, 감수하다, 인정하다
accessible,접근하기 쉬운, 닿을 수 있는
accidental,우연의, 뜻밖의, 비본질적인, 부속적인
acclaim,갈채하다, 환호하다, 찬양하다, 큰 소리로 말하다, 외치다
accomplice,공범자, 한패, 한통속
accordingly,따라서, 적절히
account,설명하다, 밝히다(for), 책임지다, 기술, 서술, 이야기, 담화, 기사, 예금계좌, 계산서
accumulate,축적하다, 모으다; 모이다, 늘다
accuse,고발(기소, 고소)하다, 비난하다, 책망하다
accustom,길들게 하다; 익숙하게 하다
acerbate,화나게 하다, 시게 하다, 쓰게 하다, 쓰라린, 신랄한; 화나는
achieve,성취하다, 획득하다
acknowledge,(잘못, 사실, 존재등을)인정하다, 승인하다, 감사하다, 사례하다
acquaint,정통하게 하다, 알게 하다, 알리다, ~에게 소개하다
acquiesce,잠자코 따르다; 묵인하다
acquire,취득하다, 습득하다, 배우다, 몸에 익히다
acquit,무죄라고 하다, (혐의를)벗겨주다, 석방하다
acrimonious,(태도, 말등이)통렬한, 신랄한; 얼얼한
acronym,두문자, 약성어(머릿글자로 된 말)
active,활동적인, 활발한; 적극적인, 의욕적인
acute,뾰족한, 예리한; 예민한, 격렬한, 강렬한, 심각한, 중대한, 급성의
adamant,양보할 줄 모르는, 고집불통의, 견고한, 매우 단단한, 견고한 것
adapt,~을 적응시키다, 적합하게 하다, 개작(각색, 번안)하다, 적응하다, 순응하다
added,여분의, 추가의
addict,중독되다, 탐닉하다, (마약등의)중독자, 탐닉자
address,주소; 연설, 강연, (~에게)말을 걸다, 연설하다; (항의 등을) 제기(제출)하다
adduce,(증거로서) 제출하다, 인용하다, 예를 들다
adept,숙련자, 노련가, 숙련된, 숙달된, 노련한
adjacent,인접한, 이웃의, 직전의, 직후의
admire,존경하다; 동경하다, 숭배하다; 칭찬하다
admittedly,널리 인정되고 있는바와 같이; 명백히
admonish,충고하다, 설득하다, 훈계하다, 주의를 환기시키다, 촉구하다, 요구하다
adulterate,불순하게 하다, 타락시키다, 품질을 떨어뜨리다, 진짜가 아닌, 불순물을 섞은
advance,진보하다; 승진하다, 승진시키다; 의견을 제출하다, 전진의; 선발의; 선불의
advantageous,이로운, 유익한
adventitious,우연한, 우발적인, 외래의
adverse,반대하는, 적의를 품은, 반대인, 반대쪽의, 불리한, 불운한
affable,사귀기 쉬운; 상냥한, 부드러운
affect,~에 영향을 미치다, 작용하다, (질병 등이)~을 해치다, 덮치다, ~을 가장하다, ~인 체하다
affiliation,합병, 제휴
affluent,풍부한, 유복한
afford,주다, 제공하다
aftermath,결과, 여파
agenda,의사일정, 의제; 협의사항
aggravate,악화시키다, 괴롭히다, 화나게 하다
agile,민첩한, 기민한, 재빠른
agitate,선동하다, 동요시키다
agonize,몹시 괴롭히다, 고뇌하게 하다; 괴로워하다
agreeable,기분 좋은, 쾌적한; 상냥한; 기꺼이 동의하는
alarm,공포, 놀람; 비상 경보; 자명정, 놀라게 하다; 경보를 울리다
alias,가명, 별명
alight,~에서 내리다; ~에 내려앉다; 착륙하다; 우연히 마주치다, 발견하다(on)
alike,서로 같은, 비슷한; 마찬가지로, 동등하게
all thumbs,서투른
allege,(증거없이)주장하다, 우겨대다
alleviate,(고통을) 완화시키다, 경감하다
allot,할당하다, 분배하다
allowance,허락, 허가, 용인; 승인, 인가
almighty,전능한, 만능의; 어마어마한
aloud,큰 소리로, 소리내어
alter,바꾸다, 고치다, 변하다, 바뀌다
alternative,양자택일, 대안, 선택적인; 대신하는
altruistic,이타적인
amalgamate,합병시키다, 혼합하다, 융합하다
amass,모으다, 축적하다; 모이다
amazing,놀랄 만한, 굉장한
ambience,분위기, 환경, 주위, 외계
ambiguous,모호한, 분명하지 않은
ambush,매복, 잠복, 매복하다, 매복 기습하다
amend,(의안을) 수정하다; (행시을) 고치다
amenity,생활을 즐겁게 해주는 것, 오락시설
amicable,우호적인, 평화적인
amid,~의 한복판에, ~에 둘러싸여
amorphous,무정형의, 형태가 없는
ample,풍부한, 충분한
anachronism,시대착오, 시대에 뒤진 사람(사물)
analogous,유사한, 닮은, 비슷한(to)
anchor,단단히 고정시키다; 닻을 내리다, 정박하다; 닻; 사회자, 앵커
ancient,고대의, 오래된; 구식의
annex,(소국, 영토등을) 합병하다, 부가하다, 첨부하다, 횡령하다
annual,해마다의, 한 해 한 번씩의, 연감, 연보, 일년생 식물
anonymous,작자 불명의, 신원 불명의, 익명의
antarctic,남극 지방, 나극 대륙, 남극 지방의
anthropology,인류학, 문화인류학
anticipate,기대하다, 고대하다, 예기하다, 예상하다; 미리 걱정하다
antidote,해독제, 방어수단, 대책
antipathy,반감, 혐오
apathetic,무감각한, 냉담한, 관심이 없는
aperture,구멍, 갈라진 틈, 균열
apparel,(집합적)의류; 옷, 의상
appease,달래다, 진정시키다
applause,박수갈채, 칭찬
appliance,가구, 장치, 설비, 전기제품
appreciate,사물을 바르게 평가하다, 가치를 인정하다, 이해하다, 인식하다
apprehend,뜻을 이해하다; 개닫다, 감지하다, 체포하다, 걱정하다
approach,접근하다, 교섭하다, 착수하다; 다가오다, 접근법, 방법; 접근, 구애; 입구, 출입로
appropriate,적당한, 어울리는, 알맞은
arbitrary,제멋대로인, 변덕스러운
arboretum,식물원, 수목원
archaic,고대의; 오래된, 낡은; 고풍의
arduous,(일이) 힘드는, 곤란한, 분투적인, 끈기 있는, 불굴의
arid,마른, 습기가 없는, 불모의, 무미건조한, 재미없는
armchair,안락의자, 경험에 의하지 않은, 탁상공론적인
arraign,(법률) 죄의 인정 여부를 심문하다; 비난하다, 규탄하다, 공소, 심문, 비난
arrest,체포하다, 검거하다, 억류하다, 체포, 검거, 구속
arrogant,거만한, 오만한, 젠체하는; 건방진
articulate,(말, 표현 등이) 명료한, 조리있는
artificial,인조의, 인위적인, 부자연스런, 가짜의, 모조의
aspire,열망하다, 포부를 가지다
assemble,모으다, 소집하다; 조립하다; 모이다
assert,단언하다, (권리를)주장하다
assess,평가하다, 감정하다, 견적하다, (세금따위를) 정하다
asset,자산, 재산, 유용한 자질, 이점, 강점
assiduous,부지런한, 근면한, 지칠 줄 모르는, 끊임없는, 계속하는
assort,분류하다; 조화하다, 어울리다
assure,보증하다, 보장하다, 책임지다, 안심시키다, 확신시키다
astronomer,천문학자
atheist,무신론자
atmosphere,공기, 대기; 분위기, 환경
atrocity,잔악한 행위; 흉악, 잔악, 큰 실수, 엉망진창의 일
atrophy,(영양 부족에서 오는) 위축, 쇠약; 발육불능, 도덕심의 감퇴, 퇴폐
attach,붙이다, 접착하다; 가입시키다, 첨부하다
attenuate,약화시키다, 약하게 하다
attractive,마음을 끄는, 호감이 가는, 매력적인
attribute,속성, 특질, 원인을 ~에 돌리다, ~의 탓으로 하다
audacious,대담한, 겁이 없는
auditory,귀의, 청각의
augment,증가시키다; 증가하다
auspicious,길조의, 상서로운, 전도가 밝은
austere,꾸미지 않은, 간결한, 검소한, 엄한, 엄격한, 엄숙한
authenticate,입증하다, 확증을 세우다
automation,자동화, 자동제어 기계
autonomous,자치권이 있는, 자치의, 자율의
avaricious,탐욕스러운
average,평균(치), 보통 수준, 평균의
avert,(위험, 타격등을) 피하다, 막다
aviation,비행(술), 항공(술), 항공기; 항공산업
backbone,중추; 척추
ban,금지하다, 금지, 금제, 파문, 추방
banal,진부한, 상투적인
bank,물가, 기슭; 둑, 제방; 은행
banner,기; 광고용 현수막, 인터넷의 배너광고; 대대적으로 보도하다; 우수한
barely,거의 ~않다, 간신히, 겨우, 가까스로
bargain,싸게 한 물건; 턱없이 쌈, 의외로 쌈, 매매 계약, 거래; 협정, 흥정하다, 교환하다
barter,교환하다, 물물교환, 교역
beam,빛나다, 비추다; 밝게 미소짓다, 광선
bear,운반하다; 낳다, 산출하다, 생기게 하다; 지탱하다, 견디다
beat-up,사람이 지친, 녹초가 된, 못 쓰게 된
becoming,어울리는, 알맞은, 적절한
beef-up,종강, 보강
behalf,이익, 자기편
belated,뒤늦은, 때늦은; 시대에 뒤떨어진
belligerent,호전적인, 교전중인; 교전국의, 교전국, 전투원
beneath,~할 가치가 없는; ~보다 낮은
benediction,축복; (식전, 식후의0감사기도
benefactor,(학교, 병원, 자선기관의) 후원자, 선행자
benevolent,인자한, 자비로운, 인정많은, 호의의
benign,상냥한, 친절한; 자애로운, 온화한, 양성인
bent,기호, 성향, 성벽, 성질; 경향
beset,~을 괴롭히다, ~을 에워싸다, 포위하다, 습격하다, ~을 장식하다, 박아 넣다
besiege,~을 포위하다, ~을 둘러싸다, 공격하다, 강요하다, (공포, 불안따위가)~을 엄습하다
bestial,짐승 같은, 야만적인, 흉포한
beverage,마실 것, 음료
bigotry,편협(한 행위), 고집 불통
bilateral,쌍방의, 쌍무적인, 양쪽면이 있는, 양자간 협정
biochemistry,생화학
bizarre,별난; 기묘한, 이상한, 기괴한
black-out,정전, 등화관제, 기억상실, 보도관제, 보도제한
blamish,오점, 결점, 흠, 더럽히다, 손상시키다
blanch,~을 희게 하다, 표백하다, (공포, 질병이 얼굴을) 창백하게 하다
bland,온화한, 부드러운; 김빠진,
blast,돌풍, 한바탕의 바람, 폭발, 비난, 공격, 나팔등을 불다, 로켓등을 발사하다, 야단치다(off)
bleak,(장래, 전망등이)어두운, 암울한, 적막한, 쓸쓸한, (날씨가) 차가운
blithe,즐거운, 유쾌한, 명랑한, 쾌활한
block,장애물
blunder,큰 실수; 터무니없는 실책, 큰 실수를 저지르다, 그르치다, 무심코 입 밖에 내다
blunt,무딘, 뭉뚝한, 둔한, 퉁명스러운, 무뚝뚝한
blur,흐림, 침침함, 번진 자국, 더러움, 때, 흐리게 하다
blush,붉어지다; 부끄러워하다, 부끄러움, 수줍음; 홍조
bluster,고함치다; 위협하다, 휘몰아치다, 호통치다, 위협하다, 휘몰아침
bode,징조가 되다
bold,대담한, 용감한
bolster,보강하다; 지지하다
bombshell,깜짝 놀라게 하는 일(사람), 돌발사건
bondage,속박, 굴레, 감금, 굴종, 노예의 신분
boom,갑자기 경기가 좋아지다, 인기가 좋아지다, 폭등하다; 붐을 일으키다
boost,경기를 부양하다, 선전하다, 밀어올리다; 가격을 올리다, 증대시키다
bourgeois,중산계급, 자본가, 부르주아
bout,한 바탕, 한 차례, 일시적인 기간, 시합, 한판 승부, 발작; 발병 기간
brag,자랑하다(of/about), 허풍, 자랑, 자랑할 만한
breed,(새끼를) 낳다, (알을) 까다, 만들어내다, 개량하다, 일으키다, 야기시키다, 종; 품종
brevity,(문장, 문체의) 간결, 짧음, 순간
brilliant,빛나는, 눈부신, 반짝이는, 훌륭한, 멋진, 화려한
brink,가장자리, 가 끝, 언저리, 위기, 중대한 국면; 찰나
bristle,성내다, 안달하다, 털이 곤두서다, 빽빽하다, 가득하다, 털을 곤두세우다, 빳빳한 털
brittle,부서지기 쉬운, 깨지기 쉬운, 상처입기 쉬운; 불안정한, 다루기 힘든; 성마른
brute,짐승, 짐승같은 사람
budding,눈트기 시작한; 나타나기 시작한
bulky,부피가 큰; 커서 다루기 힘든
burgeon,갑자기 출현(발전)하다, 싹이 트다, 눈이 나오다, 움, 눈, 싹, 새싹
bury,묻다, 매장하다, 숨기다, 가리다
bustle,부산하게 움직이다, 바쁘게 일하다, (구어)활기가 넘치다, 흥청거리다, 서두르다, 활기
buttress,(사람, 계획등을) 지지하다, (주장을)~으로 강화하다, 버팀벽으로 받치다, 버팀벽
bystander,방관자, 구경꾼
cache,은닉처, 저장소, 저장하다, 감추다
cadaverous,시체와 같은; 창백한, 수척한
caliber,재능; 도량, 인품, 품질; 등급, 직경; (총포의)구경
callous,무감각한, 냉정한, 냉담한, 굳어진, 못박힌
candid,솔직한, 숨김없는, 거리낌없는, 공정한, 공평한; 편견없는
candor,솔직, 정직; 성실, 공평, 공명정대
capacity,smdfur, 정신능력, 포용력, 수용력, 도량, 수용인원, 용량, 용적
capitalize,이용하다, 기회로 삼다, 자본화하다; 투자하다, ~을 이용하다, 대문자로 쓰다
capitulate,항복하다; 굴복하다, 저항을 그만두다
capricious,변덕스러운, 마음이 변하기 쉬운, 불규칙적인
capsize,뒤집다, 뒤집히다, 전복시키다
carefree,무사태평한, 근심 걱정이 없는
cargo,화물, 짐
caricature,풍자만화; 서투른 모방, 풍자하다
carnivorous,육식성의, 육식동물의
catastrophe,큰 재해, 대참사, 파국, 비극적 결말, 대실패; 재난, 불행, 불운, 대단원, 격변, 변동
catchy,사람의 마음을 끄는, 매력있는, 틀리기 쉬운, 단속적인, 변덕스러운
categorize,분류하다
caviler,트집쟁이
celebrate,축하하다, 찬양하다
censure,비난, 책망, 견책; 혹평, 비난하다, 책망하다, 혹평하다
central,주요한, 중앙의, 중심부의
certify,증명하다, 인증하다, 보증하다
chagrin,억울하게 하다; 분하게 하다, 억울함, 원통함, 분함
chamber,방, 침실
champion,앞장서서 ~을 옹호하다, 우승자, 투사, 옹호자
channel,(관심, 노력 등을 어떤 방향으로) 돌리다, 경로, 수로, 해협
chaotic,혼란한, 무질서한
characteristic,독특한, 특징적인, 특성, 특질
charitable,관대한, 자비로운, 자선의
chart,(지도, 도표 등을) 작성하다, 계획하다, 도표, 그래프
cheat,속이다, 속여서 빼앗다; 부정행위를 하다, 몰래 바람피우다
cherish,소중히 여기다, 귀여워하다; (마음에) 간직하다, 품다
chilling,무서운, 으슬으슬한, 쌀쌀한; 냉정한
chisel,끌, 조각칼, 조각하다, 새기다
chop,절단하다, 잘게 썰다
chronic,상습적인, 오래 끄는, 고질적인, 만성적인, 병 환자
circulate,돌다, (혈액 따위가)순환하다, 돌다, 퍼지다, 유포하다, 배포하다
circumspect,신중한, 용의주도한, 치밀한
circumvent,(교묘하게)회피하다, 남을 속여 넘기다, 기만하다, ~을 돌다, ~을 우회하다
cite,인용하다, 예로 들다, 소환하다, 출두를 명하다
civil,예의 바른; 시민의, 민사의
clandestine,은밀한, 암암리의, 남몰래 하는
clasp,고정시키다, 꽉 쥐다, 껴안다, 악수, 포옹
classic,전형적인, 대표적인, 표준의, 모범적인, 일류의 최고수준의; 고전의
classification,분류(법), 범주, 유형
claustrophobic,폐쇄(밀실) 공포증의
cleanse,깨끗이 하다, 깨끗한, 살균의, 위생적인
clement,온화한, 관대한, 따뜻한
cling,달라붙다, 집착하다; 습관이 배다(to)
clip,(털, 가지 등을) 자르다, 깎다; 오려내다, 구멍을 내다; 제한하다, 꽉 쥐다, 클립
clog,~을 방해하다, 우울하게 하다; 괴롭히다, 막히다, 방해, 장애; 고장
clone,복제 인간(생물), 복제 세포; 똑같은 사람, 복제하다
cluster,밀집시키다, 떼짓게 하다, 떼짓다, 밀집하다, 송이, 다발, 무리
clutch,꽉 붙잡다; 권력을 쥐다, 클러치; 위기
coalition,연합, 합동, 제휴, 정당간의 연합
codify,법전으로 편찬하다, 성문화하다, 체계적으로 정리하다; 분류하다
coerce,강제하다, 위압하다, 강요하다, 억압하다, 구속하다, 지배하다
coherent,일관성 있는, 조리가 선, 일치하는, 알기 쉬운, 서로 밀착되어 있는, 응집성의
coincide,동시에 일어나다, 일치하다, 맞다, 부합하다
collaborate,공동으로 일하다, 합작하다; 제휴하다, 협력하다, 부역하다
collapse,무너짐, 붕괴; 폭락; 계획의 실패, 무너지다, 붕괴하다, 좌절하다, 무너뜨리다, 접다
collide,부딪치다, 충돌하다, 일치하지 않다, 상충하다
colloquial,구어(체)의, 일상 회화의, 격식을 차리지 않은
colonize,식민지로 만들다; 이주시키다, 이식하다; 정주하다
colossal,거대한, (수량등이) 엄청난, 놀라운, 어마어마한
commencement,시작, 개시, 졸업식, 학위 수여식
commensurate,같은 정도의, 적당한, 균형이 잡힌
commiseration,가엾게 여김, 연민, 동정의 말
commodity,상품; 일용품, 필수품, 유용한 것
commonplace,평범한, 일상적인; 진부한, 평범한 것, 흔한 일; 상투어
commuter,정기권 통근자, 교외 통근자, 통근자의
comparatively,비교적, 꽤
compassion,측은히 여김, 동정, 연민
compatible,양립할 수 있는, 모순없는; 적합한, 조화하는, 호환성의
compel,~시키다, 강요하다
compensate,보상하다, 배상하다(for), 보완하다, 상쇄하다, 보충하다, 메우다
competent,유능한, 능력이 있는, 요구를 충족시키는, 충분한
complacent,마음에 흡족한, 자기 만족의, 무관심한
complain,불평하다, 한탄하다; 호소하다
complex,복합의, 복잡한, 뒤얽힌, 복합체, 합성물, 복합빌딩, 종합청사, 강박관념, 고정관념
compliance,유순, 고분고분함, 응낙, 승낙, 수락
complicity,공범; 공모, 연루
complimentary,무료의, 초대의, 칭찬하는, 경의를 표하는
composure,침착, 냉정, 평정
compound,혼합의, 합성의, 복잡한, 혼합물, 합성물, 뒤섞다, 혼합하다, 타협짓다, 고소를 취하하다
comprehensive,포괄적인, 종합적인, 넓은, 광범위한, 이해력이 있는, 이해가 빠른
comprise,포함하다; ~으로 이루어지다, 구성되다; 부분이 모여 전체를 이루다
compromise,타협, 양보; 화해, 절충안, 절충물, 위태롭게 함, 타협시키다; 화해시키다, 더럽히다
compute,계산하다, 산정하다; 평가하다
conceal,숨기다, 비밀로 하다
concede,인정하다, 시인하다; 승인하다, 부여하다, 양보하다; 용인하다
conceit,자부심, 자만심, 상상, 즉흥적인 생각, 착상, 우쭐대다, 생각하다
concentrate,집중하다, 모으다; 집중시키다; 군대를 집결시키다, 농축되다, 집중하다
concert,협조, 제휴, 협력; 일치; 조화, 음악회, 연주회, 콘서트, ~을 계획하다, 안출하다
concoct,(음모등을) 꾸미다, 꾀하다, 꾸며내다, 날조하다
concord,일치, 조화, 화합, 협정, 협약
condense,요약하다, 간략하게 하다, 농축하다, 응축하다, 집중시키다, 모으다
conditional,조건부의, 잠정적인, ~의 여하에 달린
conduct,실시하다; 처신하다, 행동하다, 지휘하다, 행위, 품행, 거동
confer,협의(의논)하다(with), 수여하다, 주다
confidential,기밀의, 비밀의; 내밀한, 비밀을 터놓는, 친밀한, 심복의
configuration,배치; 외형, 윤곽
confine,~을 한정하다, 제한하다, ~을 가두다, 구금하다
conflict,대립하다, 충돌하다; 싸우다, 다투다, 싸움, 전투; 충돌
conform,따르다, 순응하다, 들어맞게 하다; 합치시키다
confront,직면하다, 맞서다; ~와 대면시키다
congenial,알맞은; 쾌적한, 기분좋은, 마음이 맞는
congest,붐비다, 혼잡하다(with), 붐비게 하다, 정체시키다
congregate,~을 많이 모으다, 모이다; 집합하다, 모인; 집단의, 집단적인
congruous,일치하는, 조화하는; 적절한, 적당한
conjugal,부부간의 혼인상의
conscience,양심, 선악의 판단력, 도의심, 분별, 양심적임
conscript,징집하다, 징병하다; 징발하다, 징집병, 신병
consecutive,논리가 일관된, 앞뒤가 맞는, 연속적인, 계속되는
consensus,총의, 여론, 대다수의 의견, 일치, 협의
conserve,보존하다, 유지하다, 보호하다
considerable,중요한; 고려해야 할, 무시하지 못할, 적지 않은, 상당한, 꽤 많은
console,위로하다, 위문하다, 제어 장치; 대형 오디오, 텔레비전 등의 캐비닛
consonant,일치하는, 조화하는, 모순되지 않는, 조화하는, 협화음의, 자음
conspicuous,두드러진; 뛰어난, 눈에 잘 띄는, 저명한, 현저한
constructive,건설적인, 구조적인, 구성적인
consumption,소비, 소비량, 폐결핵
contagious,(접촉) 전염성의; 전염 독이 있는, 옮기 쉬운; 보균자의
contaminate,더럽히다, 오염시키다, 타락시키다
contemplate,심사숙고하다, 잘 생각하다, 묵상하다, 감상하다, 응시하다
contemporary,현대의, 당대의, 동시대에 일어나는, 동시대의, 같은 시대(나이)의 사람
contempt,경멸, 멸시, 모욕
contentious,다투기 좋아하는, 논쟁하기 좋아하는, 논쟁을 불러일으키는
context,문맥, 전후관계, 정황, 배경
continent,육지; 본토, 절제하는, 금욕의, 극기의
continually,계속적으로, 끊임없이, 줄곧, 빈번히, 자주
contract,수축하다, 축소되다, 줄다, 쪼그라들다, ~와 계약하다, 병에 걸리다; 습관이 붙다, 계약
contradict,부정하다, 부인하다; 반박하다, 항변하다
contrary,반대, 정반대, ~에 반대되는, ~와 서로 용납하지 않는; 외고집의, 반대로
contribute,기부하다, 주다, 기고하다, 기여하다, 공헌하다
contrite,죄를 깊이 뉘우치고 있는, 회개하는
control,지배하다, 통제하다; 억제하다
conventional,관습적인, 인습에 사로 잡힌; 전통적인; 틀에 박힌, 형식적인, 상투적인
converge,모이다, 집중하다, 한데 모아지다
conviction,유죄 판결, 죄의 자각, 양심의 가책, 회오
convince,확신시키다, 납득시키다, 수긍하게 하다
cooperate,협력하다, 협동하다, 서로 돕다
copious,풍부한, 막대한, 내용이 풍부한; 자세히 서술하는, 다작의
cordial,마음에서 우러난, 성심성의의, 원기를 돋우는, 코디얼 주, 주스; 강장제
corpulent,뚱뚱한, 비만한
correct,고치다, 바로잡다, 정정하다, 옳은, 정직한
correlate,상호 관계를 나타내다; 서로 관련시키다(with)
corrosive,부식성의, 부식하는, 통렬한, 날카로운
corrupt,타락한, 퇴폐한, 부도덕한; 사악한, 부정한, 뇌물이 통하는, 오염된, 타락시키다
cosmetic,겉치레의; 표면적인, 화장용의, 미용의; 성형의, 화장품, 겉치레, 눈속임
cosmopolitan,전 세계적인, 세계주의의, 세계주의자, 세계인
costly,값비싼, 비용이 많이 드는; 낭비하는
council,푀의, 평의회, 자문회의; 지방의회, 시의회
count,중요하다, 가치가 있다; 세다
counter,반대하다, 반박하다, 반대의, 거꾸로의
counteract,거스르다, 방해하다, 훼방하다; 좌절시키다, 반대로 작용하다
counterfeit,위조의, 가짜의; 모조의, 사이비의, 위조 물건; 모조품, 모조하다, 흉내내다
coup,쿠데타; 불시의 일격; 대성공, 큰 히트
courier,급사, 특사, 밀사, 급송 택배; 급한 소식을 전하는 수단, 안내원, 가이드
courteous,예의바른, 공손한, 세련된; 인정많은
coverage,적용 범위, 보상 범위, TV등의 유효 시청 범위, 신문의 보급범위
covetous,(남의 것을) 몹시 탐내는, 탐욕스러운
cozy,아늑한, 안락한, 편안한; 기분 좋은, 친해지기 쉬운, 아늑하게 하다, 위로하다
crackdown,일제 단속; 법률의 엄격한 시행
cramped,답답한, 비좁고 갑갑한, 읽기 힘든
crave,간청하다; 갈망하다, ~을 필요로 하다
creative,창조적인, 독창적인
credulous,남의 말 등을 잘 믿는, 잘 속는, 속기 쉬운
critique,비평, 평론, 비평하다
crooked,마음이 비뚤어진, 부정직한, 굽은, 만곡한, 뒤틀린, 기형인, 불구의
crowd,군중, 무리, 군집하다, 붐비다
crucial,결정적인, 중대한, 어려운, 혹독한, 십자형의
crude,조잡한, 거친, 조야한, 버릇없는, 날것의; 가공하지 않은, 있는 그대로의
cryptic,수수께끼 같은, 신비스러운, 숨은, 비밀의, 이유를 알 수 없는
culminate,절정에 이르다, 극에 이르다, 드디어 ~이 되다, ~으로 끝나다
culprit,범인, 죄인; 범죄 용의자, 형사 피고인, 미결수, 원인
