english,korean
grim,불쾌한, 싫은, 험상궂은; 무서운; 불길한, 엄한, 엄격한; 잔인한, 냉혹한, 완강한; 불굴의
grip,꽉 잡다, 움켜쥐다, (관심을)끌다; 이해하다
grotesque,괴상한, 그로테스크한, 괴기한, 우스꽝스러운
grown-up,어른, 성인, 성숙한, 어른이 된
grudge,원한, 앙심, 유감, 샘내다, 인색하게 굴다; 못마땅해하다, 원한을 품다
grueling,녹초로 만드는, 기진맥진케 하는, 엄한
guarantee,보증하다; 확언하다, 장담하다, 보증, 보증서
gullible,잘 속는; 속기 쉬운
habitable,거주할 수 있는, 거주하기에 적당한
haggard,여윈, 수척한, 초췌한, 광포한, 무서운, 길들지 않은, 야생의, 야생의 매, 사나운 매
hail,촨호하며 맞이하다, 환영하다, 인사하다, 축하하다, 큰소리로 부르다, 싸락눈, 우박
hallow,신성하게 하다; 신에게 바치다, 소리치며 뒤쫓다; 큰 소리로 격려하다
hamlet,작은 마을, 촌락, (소)부락
hammer out,애써 생각해 내다; 머리를 짜내 풀다; 해결하다, 망치로 두드려 ~을 만들다
hamper,방해하다, 훼방놓다, 제한하다, 방해; 구속; 족쇄, 광주리, 손으로 드는 바구니
handful,한움큼, 한 줌; 소량, 소수
handy,바로 쓸 수 있는; 쓰기 편리한; 솜씨 좋은
hangar,격납고; 곳간, 차고
haphazard,아무렇게나 하는; 계획성 없는, 우연한, 단순한 우연
harassing,괴롭히는, 귀찮게 구는
harbor,숨겨 주다; 생각을 품다, 항구; 은신처, 잠복처
hardy,단련된, 강건한; 대담한
harmonious,조화된, 균형 잡힌; 사이가 좋은
harness,동력화하다, 이용하다, 마구를 채우다
harp,같은 말을 자꾸 되풀이 하다
harsh,거친, 난폭한, 잔인한, 귀에 거슬리는, 가혹한, 조잡한, 황량한, 적막한
harvest,수확하다, 채취하다; 획득하다
haughty,오만한, 거만한, 건방진, 불손한
haven,항구, 정박소; 피난처
havoc,파괴, 황폐, 대혼란, 무질서, 크게 파괴하다, 황폐화하다
hearsay,소문, 풍문; 평판
hearten,기운나게 하다, 격려하다
heart-rending,가슴이 찢어질 듯한, 비통한
hectic,흥분한, 혼란된; 아주 바쁜, 피로를 낳는, 소모성의, 홍조; 소모열, 폐결핵
heed,주의하다, 유의하다, 주의
hefty,크고 무거운, 육중한; 많은, 크고 억센; 힘이 있는
helm,지배, 지도; 지배적 지위, 키, 타륜; 조타 장치
hereditary,유전성의, 유전하는, 유전적인, 상속권에 의한, 세습의
heresy,이단, 이교; 반대론
hideous,소름끼치는, 섬뜩한, 무서운, 극악한; 괘씸한, 가증스러운
hierarchy,계급제(도), 계층제, 서열, 지배층, 권력층
hinder,방해하다, 저지하다; 훼방하다, 막다
homogeneous,같은 종류의 것으로 된, 동종의, 균질의
horizontal,수평면의; 평면의, 수평한, 지평선상의, 가로의, 수평의
horn,뿔; 촉수, 뿔나발, 뿔피리, 자동차의 경적
horrid,아주 싫은, 역겨운, 무시무시한, 꺼림칙한
hospitable,손님 접대를 잘 하는, 환대하는; 친절한, 흔쾌히 받아들이는, 개방적인, 쾌적한
hostile,적의 있는, 적대하는, 적의, ~에 반대하는, 불리한; 맞지 않는
hub,축; 중심
hubris,오만, 자기 과신
humble,겸손한, 겸허한; 소박한, 비천한, 낮은; 하찮게 보다; 천하게 하다, 낮추다
humiliate,굴욕감을 느끼게 하다, 창피를 주다
hunch,예감, 직감, 육감, 두꺼운 조각; 덩어리, 군살, 둥글게 구부리다, 찌르다 누르다
hunt,뒤지다, 찾다
hush,입 다물게 하다, 쉿 하다, 진정시키다, 침묵, 고요함; 쉬쉬해 버림
hybrid,잡종의; 혼성의, 잡종, 이종; 튀기, 혼혈아, 혼성물
hyperbole,과장(법)
hypnosis,최면 상태; 최면술
hypodermic,피하의, 피하 주사용의, 자극하는, 기운을 북돋우는, 피하주사; 피하주사기
ideal,이상적인, 전형의; 관념적인
identify,확인하다, 동일시하다, 동일하다고 간주하다, 감정하다, 증명하다
ignominious,불명예스러운, 수치스러운
illustrious,저명한, 유명한, 걸출한, 빛나는, 눈부신
imaginative,상상력이 풍부한; 상상하기 좋아하는, 상상의, 가공의, 공상의
imbecility,정신 박약, 저능; 어리석은 말; 무능
imbibe,마신다, 흡수하다, 섭취하다, 동화하다
immaculate,오점이 없는; 결점없는; 순결한, 티없는
imminent,임박한, 촉박한
immoderate,무절제한; 지나친
immortal,죽지 않는; 불멸의, 불변의; 신의, 불사신 같은 사람
immune,면역성의, 면제된, 면제자,
impact,영향, 감화, 효과, 충돌, 격돌, 강한 충격을 주다, 격돌하다
impair,약화시키다; 해치다, 악화되다; 줄다
impartial,치우치지 않은, 편견이 없는; 공평한
impatient,성급한, 참을성 없는, 조바심하는; 몹시 ~하고 싶어하는
impeach,탄핵하다, 고소하다; 비난하다, 나무라다
impeccable,죄 없는; 결점 없는 나무랄 데 없는
impede,늦추다, 방해하다, 저해하다
impel,몰아대다, 재촉하다, 억지로 시키다, 밀고 나아가다, 추진하다
imperative,피할 수 없는, 필수적인; 긴급한, 명령적인, 단호한; 위엄있는; 명령법의, 명령
imperceptible,지가할 수 없는, 알 수 없는, 미세한, 경미한
imperial,제국의, 황제의, 황실의; 장엄한, 당당한; 거만한; 우수한
imperil,위험하게 하다
imperturbable,침착한, 냉정한, 태연한, 동요하지 않는
impervious,통과시키지 않는, 불침투성의, 상처를 입지 않는, 손상되지 않는
impetuous,성급한; 열렬한, 맹렬한
impetus,움직이게 하는 힘, 운동력, 탄력; 자극
impiety,신앙심이 없음; 불경, 불손, 무례
implacable,달래기 어려운, 화해할 수 없는, 준엄한; 무자비한; 앙심 깊은
implement,이행(실행)하다, 필요한 권한을 주다, 도구, 용구, 기구, 의복 한 벌, 수단, 방법; 대리인
imply,암시하다, 넌지시 비추다, 뜻을 내포하다, 함축하다
impolite,버릇없는; 무례한
impoverished,가난해진, 가난한, 메마른; 허약해진
imprecise,부정확한, 불명확한, 애매한
impregnable,난공불락의, 철벽의, 끄떡 않는
imprint,도장을 찍다; 깊은 인상을 주다, 자국; 인상, 흔적; 상표
improbable,일어날 듯하지 않은, 사실 같지 않은, 기발한
impromptu,즉석에서의, 즉흥적인, 임시변통의, 즉석에서; 즉흥적으로; 임시변통으로
impute,~의 탓으로 하다, 전가하다; (성질, 속성등을) ~에게 있다고 생각하다
inactive,활동하지 않는, 움직이지 않는; 휴지의, 나태한, 게으른, 불경기의
inadequate,부적당한, 부적절한, 불충분한, 사회 적응성이 없는; 무력한
inadvertently,아무 생각 없이, 무심코 ; 우연히
inalienable,양도할 수 없는; 빼앗을 수 없는
inane,어리석은, 생각없는, 공허한, 텅 빈; 알맹이 없는, 허공, 무한한 공간
incalculable,헤아릴 수 없는, 무수한, 예상할 수 없는; 변덕스러운
incapacitate,무능력하게 하다, 자격을 박탈하다, 실격시키다
incessantly,끊임없이, 쉴 새 없이
incidence,발생, 범위, 발생률, (세금 등의) 부담
incomparable,비교할 수 없는, 비길 데 없는
inconceivable,상상도 못할; 믿을 수 없는
inconsistent,일치하지 않는, 조화되지 않는; 모순된, 지조가 없는, 변덕스러운
inconstant,일정하지 않은, 변하기 쉬운
incontrovertible,논쟁의 여지가 없이 명백한
increment,증가, 증대; 증가량, 증액, 이익, 이윤, 이득
incumbent,의무가 있는, 의무로서 지워지는, 현직의, 재직중의, 현직자, 재임자; 현직의원; 거주자
incurable,불치의; 교정 불능의, 불치의 환자; 구제 불능자
indelible,지울 수 없는; 잊혀지지 않는
indifferent,무관심한, 냉담한, 개의치 않는, 사심이 없는, 공평한, 중립의, 평범한, 시시한
indigenous,토착의, 지역 고유의, 타고난, 생득적인
indignation,분개, 분노
indolent,게으른; 무활동의, 무통성의, 게으른 사람
indoors,옥내에서
induce,권유하다; 설득하여 ~시키다, 일으키다, 야기하다, 유발하다
industrious,근면한, 부지런한
inept,서투른, 부적당한, 부적절한; 터무니 없는, 어리석은
inertia,활발치 못함, 굼뜸, 둔함, 관성, 무력
inevitable,피할 수 없는, 면하기 어려운, 부득이한, 필연적인, 지당한, 어김없는, 판에 박은
inexorable,냉혹한, 용서 없는, 움직일 수 없는, 엄연한
infer,추론하다, 추단하다, 추측하다, 결론으로서 의미하다; 암시하다
inferior,열등한, 하위의
infinite,무한한, 무궁한; 끝없는, 무한한 것; 무한대, 무한한 공간 조물주, 신
inflate,팽창하다, 부풀리다; 팽창시키다
infraction,위반, 반칙, 침해, 침범
inhibition,금지, 금제; 억제, 억압
initially,처음에, 시초에
innate,타고난, 천부의, 선천적인, 고유의, 본질적인
innocuous,해가 없는, 독이 없는, 악의가 없는
innovation,혁신, 쇄신, 기술 혁신, 새 기틀, 신제도
innuendo,풍자, 빈정대는 말, 주석, 설명 조항
inordinate,지나친, 과도한; 무절제한
inquisitive,탐구적인, 알고 싶어하는, 호기심이 강한, 호기심이 강한 사람
ins and outs,세부곡절, 자초지종, 여당과 야당, 꼬불꼬불함
insatiable,만족할 줄 모르는, 탐욕스러운
insecure,불안정한; 위태로운; 확신이 없는
inseparable,분리할 수 없는; 떨어질 수 없는
insidious,잠행성의, 교활한, 음흉한
insight,통찰력, 식견
insignificance,무의미, 무가치; 사소한 일, 하찮음
insincere,성의없는, 성실치 못한; 위선의
insolvent,지불 불능한, 파산(자)의, 지불 불능자, 파산자
inspect,세심하게 조사하다, 시찰하다, 검열하다; 사열하다
inspiration,자극, 고취, 고무, 격려, 영감, 기발한 착상, 숨을 들이마시기, 흡입
install,설치하다; 자리에 앉히다, 취임시키다, 인스톨하다
instantaneous,순간의, 즉시의, 즉시 일어나는, 동시에 일어나는, 동시적인
instill,(사상, 감정을) 주입하다; 스며들게 하다, 한방울씩 떨어뜨리다
insufferable,참을 수 없는, 비위에 거슬리는
insulate,분리시키다, 고립시키다, 절연(단열, 방음)하다
insulting,모욕적인, 무례한
insuperable,극복하기 어려운, 무적의
intact,thseowl 않은, 손상되지 않은, 완전한
intellectual,지적인, 머리를 쓰는; 지력이 발달한, 지식인, 식자
intemittent,간헐적인, 때때로의; 단속적인
intent,의도, 의향; 목적, 계획; 의미, 취지, 집중된; 열심인
inter,매장하다
interchangeable,호환성이 있는, 교환할 수 있는
intermediate,중간의; 중간에 일어나는, 중간물, 중재자; 매개, 수단, 중재하다, 중개하다
interminable,끝없는, 한없는; 그칠 줄 모르는
internment,(포로 등의) 유치, 억류, 수용
interpret,설명하다, 해석하다, 통역하다
interrupt,중단시키다, 방해하다; 가로막다, 저지하다, 중단하다
intertwine,서로 얽히게 하다
intervene,중재하다; 간섭하다, 개입하다, 사이에 들다, 사이에 끼어들다
intimate,암시하다, 넌지시 알리다, 친밀한, 친숙한; 마음속으로부터의, 친한 친구
intimidate,협박하다, 겁주다, 위협하여 ~을 시키다, ~을 못하게 하다
intrepid,용맹한, 대담한; 무서움을 모르는
intricate,얽힌, 복잡한; 난해한, 복잡하게 만들다, 얽히게 하다
intrigue,당혹케 하다, 호기심을 자극하다, 흥미를 돋우다, 음모를 꾸미다, 음모, 계략, 줄거리
intrinsic,본래 갖추어진, 고유의, 내재하는, 본질적인
inundate,범람시키다, 물에 잠기게 하다, 몰려오다, 밀어 닥치다
inure,익히다, 단련하다, 효력을 발생하다; 도움이 되다
invalid,병약한; 허약한; 환자용의, 근거가 박약한, 무효의, 병자, 병약하게 하다(되다)
invaluable,값을 헤아릴 수 없는, 매우 귀중한
investigate,조사하다, 수사하다, 연구하다
invigorating,기운나게 하는, 상쾌하게 하는; 격려의
invincible,정복할 수 없는, 장애를 극복할 수 없는, 무적의, 불굴의
involved,복잡한, 뒤얽힌; 혼란한, 깊이 관련된, 말려든
iridescence,무지개 빛깔(보는 각도에 따라 색이 변함)
ironic,반어적인, 풍자적인; 빈정대는, 비꼬는
irrational,비이성적인, 비합리적인
irrecoverable,돌이킬 수 없는; 회복하기 어려운, 교정할 수 없는
irreparable,고칠 수 없는, 치료할 수 없는
irreplaceable,바꿀 수 없는, 대체할 수 없는
irrigate,물을 대다, 관개하다, 생명을 주다, 비옥하게 하다
irritate,화나게 하다, 짜증나게 하다, 염증을 일으키다; 자극하다
issue,발행; 유출; 논쟁; 문제점
jack up,(차 등을) 잭으로 들어 올리다
jam,쑤셔 넣다, 채워 넣다; 메우다, 막다, 붐빔, 혼잡; 고장; 곤란, 궁지
jaundiced,편견을 가진; 비뚤어진, 황달에 걸린
jeopardy,위험, 위난; (피고가 유죄가 될) 위험성
jot,간단히 적어두다, 메모하다, 적음, 조금
judicious,사려 분별이 있는, 현명한, 사려깊은
justly,바르게, 정확하게, 정당하게
keen,열심인, 열중한; 열망하는, 날카로운, 신랄한, 훌륭한, 멋진
kidnap,유괴하다
kitschy,천박한; 대중에게 영합하는
knockabout,소형 요트, 소형 실용차, 소란한, 법석 떠는 막일할 때 입는, 방랑생활의
knowingly,알고서, 고의로, 아는 듯이, 아는 체하고; 빈틈없이
laconic,간결한, 간명한, 말수가 적은
laden,(짐을)실은, 화물을 적재한, ~으로 가득한
languid,나른한, 축 늘어진; 활기가 없는, 마음이 내키지 않는, 열의가 없는
lapse,시간의 경과, 추이, 실책, 사소한 과실, 타락, 소멸, 실효, 폐지, 실수하다, 소멸하다
lash,묶다, 매다, 채찍; 심한 비난; 충돌, 채찍으로 때리다, 부딪히다, 심하게 나무라다
latent,숨은, 잠재한; 잠복해 있는, 잠재성의; 휴면의
lateral,옆의, 측면의, 곁가지
laudatory,칭찬(찬미)의
launch,(사업을)착수하다, 시작하다; 배를 진수시키다
lavish,낭비벽이 있는, 사치스러운; 무절제한, 아끼지 않는, 후한, 풍부한, 충분한, 넉넉한; 남아도는
leading,선도하는, 우세한, 주요한
lease,임차하다, 임대하다, 임대차; 리스
leftover,나머지, 찌꺼기, 남은 음식, 나머지의, 남은
legible,읽기 쉬운, 판독할 수 있는, 명료한
legitimate,합법적인, 적법의, 정당한, 합리적인, 정통의, 정규의, 합법으로 인정하다
leisurely,느긋한, 여유있는, 천천히, 유유히
lengthen,길게 늘이다, 연장하다
lenient,너그러운, 인자한, 다정한, 관대한, 완화시키는
lethal,치명적인; 죽음에 이르는, 치사의
lethargic,무기력한, 활발하지 못한; 혼수 (상태)의
liability,부채, 채무, 빚, 책임, 책무, 불리한 일, ~하기 쉬움, 걸리기 쉬움
libel,중상, 비방, 모욕하는 것, 명예 훼손, 비방, 중상하다
lifeless,생명이 없는, 죽은; 활기가 없는
linguist,언어학자; 외국어에 능통한 사람
listless,생기가 없는, 나른한; 마음이 내키지 않는 무관심한
literacy,읽고 쓰는 능력; 교양있음, 교육받음, 지식, 능력
litigate,소송을 제기하다; 법정에서 다투다, 논쟁하다
livelihood,생계, 살림
liver,간장, 간, ~식으로 생활하는 사람; (미)거주자, 간장색의, 적갈색의
load,적재 화물, 짐; 가득 짐을 싣다
loathe,몹시 싫어하다; 질색하다, 혐오하다
locally,국지적으로
logic,논리학, 논리; 이치
longevity,장수, 수명
longing,갈망, 열망, 동경, 갈망하는, 동경하는
loom,흐릿하게 보이다, 불안하게 다가오다, 베틀, 직기
loquacious,수다스러운, 말이 많은
lucrative,이익이 있는, 수지맞는; 유리한
lukewarm,미지근한, 미온적인, 열의가 없는, 마음이 내키지 않는
luminous,빛나는, 번쩍이는, 이해하기 쉬운, 명쾌한, 총명한; 식견이 있는
lure,유인하다; 유혹하다, 유인하는 것; 마음을 끄는 것, 미끼, 가짜 미끼; 올가미
luster,광택, 윤; 광을 내다, 윤이 나다, 호색한; 갈망하는 사람
magnitude,크기, 양, 규모, 큼, 다량, 광대함, 중요함, 중대성
mainspring,시계의 큰 태엽; 주요 원인
maladroit,서투른, 솜씨 없는, 요령없는
malady,병, 질병, 혼란, 병폐, 폐해
malign,해로운, 악의가 있는, 악성인, 헐뜯다, 중상하다
malnourished,영양 불량(실조)의
manage,경영하다, 다루다, 관리하다, 그럭저럭 잘 해 나가다, 억지로 ~하다
mandatory,강제의, 의무의, 필수의, 명령의, 위임의, 수임자, 위임 통치국
manifest,명백히 하다, 분명하게 보여주다, 의견을 공표하다, 나타나다, 분명한, 송장, 승객명단
manifold,가지각색의, 잡다한, 다방면의 복사한 사본
marginal,주변적인, 별로 중요하지 않은, 변두리의, 주변의, 한계의, 최저한의
maritime,바다의, 해운상의; 해상 무역의, 연해의, 해변의; 선원다운, 선원 특유의
marshal,정렬시키다, 정돈시키다, 연방 보안관, 육군의 원수
master,정통하다, 숙달하다
masterpiece,걸작, 명작; 대포작
match,경쟁시키다, ~에 필적하다, 대등하다; 조화하다, 경기, 시합
material,중요한, 필수적인, 본질적인, 구체적인
maturity,성숙(기), 원숙, 완성, 만기일
maul,뭇매질하다; 짐승 등이 할퀴어 상처내다, 난폭하게 다루다; 혹평하다, 큰 메, 망치
maximum,최대한, 최고액
meager,meagre/빈약한, 결핍된; 불충분한, 마른, 야윈, 내용 없는
mean,비열한, 천한, 인색한, 평균의, 보통의, 중간의, 의미하다, 의도하다
measure,측정하다, 잴 수 있다
mechanism,기계 장치, 도구; 절차, 방법; 기교, 수법
meddling,참견하는, 간섭하는, 간섭, 참견
meditate,숙고하다, 깊이 생각하다, 명상하다, 꾀하다, 기도하다, 계획하다
meet,만족시키다, 충족시키다; 회합하다; 합류하다, 회합, 모임; 운동회, 대회
memorable,기억할 만한, 인상적인
menace,위협하다, 협박하다, 겁주다, 협박, 위협, 공갈, 골칫거리, 말썽꾸러기
mendacity,허위, 거짓말; 거짓말하는 버릇
merchandise,상품, 제품; 재고품, 장사하다, 매매하다
merciless,무자비한, 잔인한
mere,단지 ~에 불과한, 순전한, 대수롭지 않은
merge,병합하다; 융합하다(시키다)
messy,어질러진, 흐트러진, 지저분한, 단정치 못한, 꼬인, 혼란스럽게 된
metamorphosis,변형, 변질, (생물) 변태
meticulous,세심한, 꼼꼼한, 신중한, 작은일에 신경을 쓰는; 소심한, 좀스러운
microbe,미생물, 세균; 병원균
migrate,이동하다, 이주하다(from, to)
milestone,이정표, 획기적인 사건, 중대시점
minimize,최소화하다, 줄이다; 과소 평가하다
minister,봉사하다, 섬기다; 기여하다, 공헌하다, 성직자, 목사; 장관; 외교사절; 대리인
minute,미소한, 미세한; 상세한, 정밀한, 분, 순간, 잠깐; 적요, 적어두다, 의사록에 기록하다
misconception,잘못된 생각, 오해
miserly,인색한, 몹시 아끼는
misgiving,의심, 걱정, 불안, 염려
misnomer,잘못된 명칭, 오칭; 인명,지명의 오기
mnemonic,기억을 돕는; 기억(술)의
moan,신음하다, 한탄하다, 투덜대다
mobile,움직일 수 있는, 이동성을 가진; 기동성의; 변하기 쉬운, 이동전화, 모빌
moderate,절제있는, 온건한; 알맞은, 적당한; 보통의, 중간의, 온건한 사람
modest,겸손한, 신중한; 정숙한; 적당한, 삼가는
modify,변경하다, 수정하다; 개조하다, 완화하다, 조절하다
moist,축축한, 습한
molten,(금속 등이) 녹은; 주조한; (정열이) 타는 듯한
momentous,중대한, 중요한
monetary,금전의; 금융의, 재정의, 화폐의, 통화의
monk,수도사; 성직자
monumental,기념이 되는; 기념비의, 불후의; 역사적 의미가 있는; 터무니없는, 엄청난
morbid,무서운, 무시무시한, 병적인; 음울한, 병리학적인
moreover,게다가, 더욱이
moribund,다 죽어가는, 소멸해 가는, 침체한, 정체한
mouthful,한 입 가득; 소량; 중요한 말
multiracial,다민족의, 여러 민족으로 이루어진, 혼혈인
mundane,현세의; 세속적인, 평범한, 흔히 있는, 일상적인
mustache,코밑수염
mutable,변하기 쉬운, 변덕스러운
mute,무언의, 침묵한; 묵비권을 행사하는, 벙어리
mutilate,절단하다, 불구로 만들다, 못 쓰게 만들다, 삭제하여 불완전하게 하다
mutual,상호간의; 공동의
nadir,밑바닥, 구렁텅이, 천저
narrate,이야기하다, 해설을 덧붙이다
nascent,발생하려고 하는; 초기의
neat,정돈된, 단정한; 솜씨좋은; 간결한; 멋진
nebulous,희미한, 불투명한; 모호한, 막연한
necessary,필수적인; 필연적인, 필수품, 필요한 것
needy,가난한, 궁핍한, 궁핍한 사람들
negation,부정, 부인; 거절, 반대의 진술, 반론, 무, 결여, 비존재
negligence,태만, 부주의; 무관심
neighboring,이웃의, 인접한
nervous,신경질적인, 신경과민인, 초조한, 신경성의, 힘찬, 간결한
nevertheless,그럼에도 불구하고
nocturnal,밤의, 야간의; 야행성의, 야상곡 같은
nominal,명목상의, 명색뿐인; 아주 적은; 이름의, 명칭의
nostalgia,향수, 과거나 고향에 대한 동경
noteworthy,주목할 만한, 두드러진
notion,의견; 개념
notorious,유명한, 악명 높은
notwithstanding,~에도 불구하고
novice,초심자, 신출내기, 풋내기
nullify,무효로 하다, 파기하다, 헛되게 하다
objection,반대, 이의, 불복; 혐오, 하기 싫음, 거부
obligatory,의무로서 지워지는, 의무적인, 필수의, 구속력이 있는
obliquely,비스듬히, 간접으로, 에둘러서, 완곡하게, 부정하게
oblivious,알아채지 못하는, 잘 잊어버리는, 건망증이 있는
obscure,분명치 않은, 불명료한; 모호한, 눈에 띄지 않는; 알려지지 않은, 가리다, 덮다
obsolete,시대에 뒤떨어진, 구식의, 못 쓰게 된, 폐기된; 퇴행한, 쇠퇴하게 하다, 폐물
obstinate,완고한, 고집센, 완강한, 다루기 힘든, 난치의
obviate,제거하다, 미연에 방지하다
occupation,직업, 업무; 종사, 점유; 거주; 점령, 점거, 재직; 재직 기간, 임기
occur,(일이) 일어나다, 발생하다; 발견되다, 출현하다; 머리에 떠오르다, 생각나다
odorous,향기로운, 냄새가 나는, 부당한, 구린
offense,offence/위반, 반칙, 범죄; 무례, 기분을 상하게 하는 것; 공격
officious,참견하기 좋아하는, 주제넘게 나서는, 비공식의; 솔직한
ominous,불길한, 나쁜 징조의; 기분 나쁜, ~의 전조가 되는
omniscient,전지의; 박식한
onset,착수, 개시, 습격, 공격, 징후, 발병
ooze,스며 나오다, 분비하다, (비밀 등이) 새다, 누설하다, 발산하다, 분비물, 습지, 진흙
opaque,불투명한; 분명하지 않은; 우둔한; 암흑
opinionated,자기 주장을 끈덕지게 고집하는
opposite,마주 보고 있는; 반대편의, 맞은편의, 정반대의, 적수, 맞은편에
optimistic,낙관적인, 낙천적인
option,선택, 선택권, 옵션; 선택 과목
opulent,부유한; 풍부한; 무성한, 화려한
orbit,생활의 궤도, 활동 범위; 세력권(범위), (천문) 궤도, 주위를 궤도를 그리며 돌다
ordeal,시련, 고난
ordinary,보통의, 평범한; 정규의, 정상의, 보통 있는 일, 상례
organ,(생물의)기관, 장기; (정치적)기관
ostensible,표면상의, 겉으로만의, 겉치레의
outbreak,(전쟁등의)발발; 발생, 창궐; 폭발
outburst,폭발, 분출
outcast,쫓겨난, 버림받은, 추방된 사람, 부랑자
outcry,울부짖음, 절규, 비명; 강력한 항의, 큰 소리로 외치다
outfit,채비; 의상 한 벌; 장비 한 벌; 마음의 준비, 공급하다, 갖추어 주다
outing,소풍, 피크닉, 산책; 앞바다
outlandish,이국풍의; 기이한, 이상한
outlaw,범죄자, 무법자, 사회에서 추방된 사람, 금지하다, 불법화하다
outlay,경비, 지출액; 소비
outrageous,난폭한, 잔인무도한; 괘씸한; 엄청난; 멋진, 훌륭한
outstanding,눈에 띄는, 현저한; 저명한, 걸출한, 미결제의, 미해결의, 쑥 내민
outstrip,~을 능가하다, 뛰어나다, 따라가 앞서다
overcome,이기다, 패배시키다, 정복하다; 극복하다
overhaul,철저히(자세히) 조사하다, 정밀 검사하다, 정비하다, 분해 검사하다, 정밀 검사, 분해 검사
overpower,압도하다, 제압하다; 감동시키다; 과도한 힘을 가하다
override,우위에 서다; 유린하다, 짓밟다; 무시하다; 무효로 하다
oversee,감독하다, 감시하다; 망보다
overshadow,~을 가리다, 어둡게 하다; 우울하게 하다
oversight,간과, 실수, 착오, 부주의
overstate,과장하다, 허풍떨다
overture,서곡, 전주곡; 도입 부문; 예비 교섭, 제안, 제안하다
overturn,뒤집다, 전복하다; 뒤집히다, 전복, 타도, 붕괴
overweenig,지나치게 자신만만한, 오만한, 교만한
overweight,중량 초과의; 과체중의, 짐을 지나치게 싣다
overwrought,너무 흥분한, 매우 혼란된
owing to,~때문에
pace,걸음걸이, 보조, 속도, 걷다
