english,korean
cultivate,경작하다, 재배하다; 양식하다, 장려하다, 구하다, 깊게 하다
cumbersome,방해가 되는, 번거로운, 성가신, 다루기 어려운, 거추장스러운
cumulate,쌓아 올리다, 모으다
curse,재앙의 원인, 파멸의 근원; 천벌, 재앙, 저주의 말, 악담, 독설
curtail,짧게 줄이다; 단축하다, 생략하다, 삭감하다, 축소하다; 박탈하다
custody,보호, 감독, 후견, 감금, 금고; 구류, 구치
customarily,습관적으로, 관례상으로
cutlery,식탁용 날붙이, 칼 제조업
dampen,축축해지다, 축축하게 하다; 풀 죽다
dart,쏘다, 던지다; 날아가다, 돌진하다; 다트
deadlock,막다른 상태, 교착, 정체, 앞이 막히다, 꼼짝 못하게 되다
dearth,기근, 식량 부족, 결핍, 부족
debacle,붕괴; 와해; 폭락, 대재해; 대홍수, 산사태
decade,10년간, 10권, 10편, 10개가 한 벌이 되는 것
decelerate,속도를 줄이다, 감속하다
decent,점잖은, 예의 바른; 차려 입은
deceptive,속이는, 현혹시키는, 믿을 수 없는
decide,분명한; 단호한
decipher,해독하다, 번역하다, 번역, 해독; 판독
decline,거절하다, 사절하다, 기울다, 쇠퇴하다, 감퇴하다, 쇠퇴, 퇴보, 하락
decorate,장식하다, 벽지를 바르다; 훈장을 주다
deduct,빼다, 공제하다, 떨어지다
deference,존경, 경의, 복종
defiant,반항적인, 도전적인, 시비조의
deficiency,부족, 결핍; 부족분; 결손, 적자, 결함
deft,손재주있는, 솜씨 좋은
defunct,현존하지 않는; 효력을 잃은, 폐지된, 죽은, 고인이 된
defuse,위기를 해제하다, 진정시키다, 신관을 제거하다
degenerate,퇴화하다; 타락하다, 타락시키다, 변질된, 타락자, 부도덕한 자
degrade,좌천시키다, 강등, 해임하다, 타락시키다, 타락하다; 퇴화하다
deign,자신을 낮추어 ~하다, 황송하게도 ~해주다, ~을 하사하다, 내리다
deject,낙심시키다, ~의 기를 꺾다
deleterious,(심신에) 해로운, 유해한
deliberate,신중한, 생각이 깊은, 사려깊은, 침착한, 느긋한, 고의의, 계획적인, 심사숙고하게 하다
delineate,윤곽을 그리다; 묘사하다
delinquent,(직무)태만자, 범법자; 비행소년, 비행을 저지른; 비행자의, 직무 태만의, 체납된
delusive,현혹적인, 착각하게 하는, 망상적인, 거짓의; 가공의
delve,철저히 조사하다, 깊이 탐구하다, 샅샅히 뒤지다, 땅을 파다, 동굴, 움푹 팬 곳
demise,서거, 사망, 죽음; 소멸, 유증; 권리 양도, 계승, 양위, 양도하다, 사망하다
demolish,(건물 따위를) 파괴하다, 헐다, 폐지하다
demonstrate,시위 운동을 하다, 논증하다; 증거가 되다, 설명하다, 표시하다, 내색하다
denounce,비난하다, 탄핵하다; 고발하다
dent,움푹 들어간 곳, 맞은 자국, 약간의 진전, 진척, 약화; 상처, 움푹 들어가게 하다
deny,부인하다, 거절하다
dependable,신뢰할 수 있는, 의지할 수 있는
deplete,다 써버리다, 고갈(소모)시키다
deplorable,매우 나쁜, 처참한; 통탄할, 한탄스러운
depredation,약탈, 파괴의 흔적
deride,비웃다, 바보 취급하다
descendant,자손, 후예, 제자, 문하생
descry,어렴풋이 ~을 알아보다, 발견하다
desecrate,신성을 모독하다, 속되게 쓰다
desert,사막, 황야, 불모지, 상을 받을 만한 자격, 공과, 사막 같은, 불모의, 버리다; 유기하다
designate,지명하다, 선정하다; 임명하다, 명시하다, 가리키다, 지적하다, 명명하다
desolate,황량한, 황폐한; 쓸쓸한, 우울한, 고독한, 황폐시키다
despair,절망하다, 단념하다, 절망, 자포자기
desperate,절망적인, 자포자기한, 필사적인, 지독한, 지나친
despondent,의기소침한, 낙담한, 실망한
despotic,전제적인, 전제정치의; 횡포한
destitute,빈곤한, 극빈의, 궁핍한
desultory,종잡을 수 없는; 산만한; 주제를 벗어난
detach,떼어내다, 분리시키다, 파견하다
detain,기다리게 하다, 붙들어 두다, 구류하다, 유치하다, 감금하다, 수용하다
detect,발견하다, 인지하다, 탐지하다
deter,방해하다, 그만두게 하다, 단념시키다, 제지하다
deteriorate,나쁘게 하다; 악화시키다, 타락시키다, 나빠지다, 악화하다, 타락하다
detest,혐오하다, 몹시 싫어하다
detour,우회, 우회로; 돌아가게 하다
detrimental,손해를 입히는, 불이익의; 해로운, 해로운 사람
devaluate,가치를 감소시키다; 평가절하하다, 가치가 떨어지다
devastate,유린하다, 황폐시키다, 압도하다
deviate,벗어나다, 일탈하다, 빗나가게 하다, 벗어나게 하다, 성적 도착자
devour,게걸스레 먹다, 탐식하다, 탐독하다, 열심히 듣다, 멸망시키다
diagnosis,진찰, 진단, 분석, 판단
dialect,방언; 지방 사투리; 통용어
dichotomy,이분법, 양단법; 이분, 양분
differentiate,구별짓다, 차별하다, 변이시키다, 특수화시키다
diffuse,퍼뜨리다, 보급시키다, 발산하다, 방산하다, 퍼지다, 흩어지다, 흩어진, 산만한
digressive,주제를 벗어난; 탈선하기 쉬운, 지엽적인
dilapidate,헐다, 헐어지다; 황폐케 하다
dilate,넓히다, 팽창시키다, 넓어지다, 팽창하다
diligently,열심히
dilute,묽게 하다, 물거지다; 희석하다, 약해지다, 묽게 한, 희석한; 묽은, 심심한
dip,살짝 담그다, 담가서 물들이다, 국자로 퍼내다; 연루시키다
disabled,지체 부자유한, 불구가 된, 신체장애의, 무능력해진, 신체장애자
disappear,사라지다, 모습을 감추다, 소멸하다
disappoint,실망시키다, 기대에 어긋나다, 좌절시키다
disavow,부정하다, 부인하다, 거부하다
disband,해산시키다, 해산하다
discard,버리다, 포기하다, 저버리다, 해고하다, 포기; 해고
discernible,인식할 수 있는
discharge,해고하다, 면직시키다, 제대시키다, 해방하다; 면제하다, 방전되다, 수행하다, 면직, 해고
disciplinary,훈련상의, 훈육의; 훈계의, 규율상의; 징계의
disclaim,부인하다, 거부하다, 포기하다
discomfit,계획을 좌절시키다; 당황케 하다, 타파하다, 패퇴시키다
discord,조화되지 않다; 불화하다, 불일치, 알력, 의견충돌, 불협화음
discourteous,무례한, 버릇없는
discreet,사려있는, 신중한; 조심스러운, 예의바른
discrepancy,모순, 불일치, 앞뒤가 어긋남, 차이점, 불일치점
discrimination,구별, 식별, 식별력, 판별력, 안목, 차별, 차별 대우
disdain,경멸하다, 멸시하다, ~할 가치가 없다고 생각하다, 경멸, 경멸감, 모멸
disentangle,얽힌 것을 풀다, 해방되다(from)
disfigure,외관을 손상하다, 망치다
disgrace,불명예, 망신, 치욕, 수치가 되다, (이름을) 더럽히다
dishearten,낙심시키다, 용기를 잃게 하다
disinformation,허위 정보, 거짓 정보
disintegration,분해, 붕괴; 분열; 분산
disloyal,불충한, 불성실한
dismal,음침한, 우울한
dismay,실망(낙담)시키다, 당황케 하다, 놀라게 하다, 당황, 어찌할 바를 모름; 놀람
dismiss,해고(면직)하다, 내쫓다(from), 지우다, 잊어버리다, 해산시키다, 퇴학시키다, 기각하다
disoriented,방향감각을 잃은; 정신적 혼란에 빠진
disparage,얕보다, 깔보다, 경시하다
disparity,서로 다름, 상이, 부등; 불균형, 불일치
dispel,헤쳐 없애다, (근심, 불안을)쫓아버리다
dispense,분해하다, 나누어 주다, 조제하다, 시행하다, 집행하다
disperse,흩뜨리다, 퍼뜨리다, 전파시키다, 패주시키다, 해산하다
displace,바꾸어 놓다, 대체하다
display,보여주다, 저시하다
displease,불쾌하게 하다, 성나게 하다
dispose,배치하다, 배열하다, ~하는 경향이 있다; ~할 마음이 나게 하다
disqualify,실격시키다, 부적임자로 판정하다
disregard,무시하다, 소홀히 하다, 무시, 경시
disrupt,붕괴시키다; 분열시키다, 혼란시키다, 분쇄하다; 파열시키다
disseminate,흩뿌리다; 퍼뜨리다
dissimilar,~와 비슷하지 않은, 다른
dissipate,흩뜨리다, 가시게 하다, 낭비하다, 흩어져 사라지다
dissuade,그만두게 하다, 단념시키다
distill,증류하다; 증류하여 불순물을 제거하다, 뽑아내다
distorted,일그러진, 비틀린; 곡해된, 왜곡된
distraction,기분 전환, 오락, 정신이 흩어짐, 주의 산만; 정신착란
distribute,분배하다, 배당하다; 배포하다, 퍼뜨리다, 뿌리다
divergent,갈라지는, 분기하는; (의견등이)나뉘는
diversity,다양성, 차이점, 여러가지, 잡다
divulge,누설하다, 밝히다
docile,온순한, 유순한; 다루기 쉬운
dodge,교묘히 회피하다, 빠져 나가다, 피하다, 날쎄게 비키다
domain,지역, 영토; 분야, 영역; 도메인
domestic,국내의; 국산의 가정의, 가정적인; 집에서 만든, 사육되는, 길든, 하인, 하녀, 종
dominate,지배하다, 위압하다, 우위를 차지하다, 우세하다, 억누르다
donate,기부하다; 증여하다
dormant,휴면 상태의, 잠자는 (것 같은)
dose,1회 복용량, 한 첩, 약이 되는 것; 한마디, 조제하다; 복용시키다; 약을 먹다
drastic,격렬한, 맹렬한, 철저한, 과감한, 대폭적인
drench,흠뻑 물에 적시다, 물에 담그다, 호우, 폭우; 흠뻑 젖음
drift,표류하다, 떠내려가다, 표류, 흐름; 경향, 동향, 추세
drive,몰다, 쫓다; 억지로 ~하게 하다, 염가 방매; 추진력, 대공세
drivel,침(콧물)을 흘리다; 철없는 소리를 하다; 낭비하다, 콧물, 군침; 어리석은 말
drizzle,이슬비가 내리다, 이슬비, 보슬비
drowsy,졸리는, 꾸벅꾸벅 조는; 졸리게 하는, 활기가 없는, 둔한
drudgery,고된 일, 싫은 일
due,지불 기일이 된; 적정한, 정당한
dull,지루한, 재미없는; 활기없는; 무딘; 우둔한
dwarf,난쟁이
dwell,살다, 거주하다; 연연하다
dwindle,줄이다, 줄다, 차츰 작아지다; 감소되다, 감소시키다
dye,염료, 물감, 물들이다, 염색하다
dynamic,동적인, 활동적인; 역학의
earmark,지정하다, 귀표를 하다, 귀표, 표시; 특징
ebullient,끓어 넘치는; 넘쳐 흐르는
eccentric,별난, 상궤를 벗어난, 기인, 괴짜; 기묘한 것
echo,반항하다; 반영하다; 되풀이하다
ecology,생태학; 인간 생태학, 자연환경; 생태, 환경보존, 환경 보존 정책
edible,먹을 수 있는, 식용에 알맞은
efface,지우다, 말소하다, 삭제하다; 지워 없애다, 눈에 띄지 않게 하다
effect,결과; 효과, 영향, 효력, 효능, 광경, 인상, 소유물, 초래하다, 이루다, 달성하다
efficient,능률적인; 효과가 있는, 유효한, 유능한, 실력있는; 적임인, 어떤 결과를 낳는, 일으키는
elaborate,정성 들인; 잔손질이 많이 간; 정교한, 뒤얽힌, 복잡한, 겉만 번지르르한, 공들여 만들다, 갈고 닦다
elastic,탄력 있는, 신축성이 있는, 휘기 쉬운; 융통성이 있는, 활달한, 쾌활한
elegant,품위있는, 우아한, 세련된, 멋진
eligible,적격의, 적임의; 바람직한, 적합한
eliminate,~을 제외하다, 무시하다, 제거하다; 삭제하다; 탈락시키다
elucidate,명료하게 하다, 밝히다, 해명하다, 설명하다
elude,교묘히 피하다, ~을 면하다; 회피하다, 생각나지 않다
emancipate,해방하다, 석방하다, 끊다
embark,착수하다; 종사하다, 타다, 태우다, 적재하다, 투자하다
embellish,아름답게 하다; 장식하다; (문장을)꾸미다, 윤색하다
emblem,상징, 표장; 전형, 귀감
embrace,포함하다, ~에 걸치다, 포오하다, 받아들이다, 잡다, 매수하다, 포섭하다
emerge,나오다, 나타나다, 떠오르다, 벗어나다, 드러나다
eminent,저명한; 훌륭한; (지위, 신분이)높은
emphasize,강조하다, 중시하다; 역설하다, 말 따위에 강세를 두다
empower,권한을 부여하다, 권력을 위임하다, ~할 능력을 주다
emulate,~을 흉내내다, 모방하다, ~와 경쟁하다, 우열을 다투다, 에뮬레이트하다
encompass,포함하다, 망라하다, 둘러싸다, 포위하다, 완수하다
encounter,부닥치다, 교전하다; 충돌하다; 맞서다, 만나다, 마주치다, 뜻밖의 만남, 마주침
encroach,침략하다, 침해하다
encumber,방해하다, 폐 끼치다; 귀찮게 하다, ~에 무거운 짐을 지우다
endangered,멸종 위기에 처한, 위험에 처한
endeavor,노력하다, 애쓰다; 시도하다, 노력
endemic,그 지방 특산의, 풍토성의, 풍토병의, 지방병, 풍토병; 고유종
endorse,보증하다; 시인하다, 지지하다; 추천하다, 배서하다
endow,기금을 기부하다, 부여하다, ~을 타고나다
endurance,내구력; 인내, 참을성
enervate,기력을 빼앗다, 무기력하게 하다
enforce,시행하다, 집행하다, 강요하다, 억지로 시키다, 강력히 주장하다
engaged,바쁜; ~에 종사하는; 교전중인
engender,일으키다, 낳다; 생기다
engross,~에 열중하게 하다, 몰두시키다, ~에 몰두하다, 독점하다
enhance,(질, 능력등을)높이다, 강화하다, (가격을)올리다
enigma,수수께끼, 불가사의한 것
enkindle,불을 붙이다; (감정, 정열을) 타오르게 하다, 타다, 타오르다
enlighten,계몽하다, 교화하다
enmesh,빠뜨리다, 말려들게 하다, 그물로 잡다, 그물에 걸리게 하다
ennui,권태, 따분함, 무료함
enormous,거대한, 막대한, 엄청난
enrich,부유하게 하다, 풍부하게 하다, (가치 등을) 높이다
ensue,뒤이어 일어나다, ~의 결과로서 일어나다
entail,일으키다, 수반하다, (노력, 비용 등을) 들게 하다, 상속인을 한정하여 양도하다
enthrall,마음을 사로잡다, 매혹시키다, 노예(상태)로 만들다
enthusiastic,열광적인, 열성적인
entice,꾀어서 ~시키다; 부추기다; 유혹하다
entitle,권리(자격)을 주다(to)
entity,실체, 존재; 본질; 실재물
entrepreneur,기업가, 사업가, 청부업자; 중개인; 흥행주
enumerate,열거하다; 낱낱이 세다; 계산하다
environment,환경, 주위의 상황
ephemeral,순식간의, 덧없는, 일시적인, 하루살이 목숨의, 명이 짧은
epitomize,~의 축도이다, 전형이다, 요약하다; 발췌(개요)를 만들다
equanimity,평정; 침착, 태연
equivalent,동등한, 같은 가치의; 같은 뜻의, ~에 상당하는, 맞먹는, 등가물; 상당어구, 동의어
equivocal,두가지 뜻으로 해석되는, 뚜렷하지 않은, 모호한; 분명치 않은
eradicate,뿌리째 뽑다, 박멸하다, 근절하다
erode,부식하다, 좀먹다, 침식하다; 점점 줄어들다
erudite,학식있는, 박식한, 학자적인
escape,달아나다, 피하다, (액체등이)새다; 기억에서 잊혀지다
esteem,존중하다, 존경하다; (높이)평가하다, 호평; 존경, 존중
esthetic,미의; 심미적인, 미적 감각이 있는
estimate,평가하다, 견적하다, 견적, 추정; 평가, 가치판단, 견적서
estrangement,이간, 불화; 소외
eternal,영원한, 불후의, 불변의, 끊임없는, 끝없는
ethics,윤리, 도덕; 윤리학
ethnic,인종의, 민족의; 민족학의; 소수민족의
euthanasia,안락사
evacuate,비우다, 명도하다, 소개시키다, 대피시키다, 철수시키다, 비우다; 배설하다
evade,피하다, 면하다, 모면하다
evaporate,수분을 빼다, 증발시키다, 사라지다
even,평평한; 한결같은
evince,명시하다, 분명히 나타내다, 밝히다, 불러 일으키다, 이끌어내다
evoke,되살려내다, 환기하다, 일으키다, 불러내다
evolve,서서히 발전시키다, 진화시키다, 발달시키다, 서서히 발전하다; 진화하다
exaggerate,지나치게 강조하다; 과장하다, 악화시키다
exasperate,격분시키다, 좌절시켜 화나게 하다
exceed,(한도를) 넘다, 초과하다, 우월하다, 능가하다
exception,제외, 예외; 이의 신청
exclude,제외하다, 배제하다, 쫓아내다 제명하다, 추방하다
excoriate,혹평하다, 벗기다
excretion,배설, 배출, 분비, 배설물
exemplary,본이 되는, 모범적인; 전형적인, 경고가 되는
exempt,면제하다, 없애주다, 면제된, 면제받은 사람; 면세자
exert,열심히 노력하다, 분투하다, (위력, 압력, 영향을) 가하다
exhaustively,철저하게, 남김없이, 속속들이
exhilarate,기분을 들뜨게 하다, 유쾌하게 하다
exhortation,간곡한 권고, 장려; 경고, 훈계
exonerate,무죄임을 입증하다, 면제하다
exotic,이국적인, 색다른; 외래의
expediency,편법; 편의주의
experimental,실험의, 실험적인; 경험적인
expire,(문서, 계약 등이 만기가 되어) 무효가 되다, 만료되다, 숨을 거두다, 죽다, 숨을 내쉬다
explicit,명백한, 분명한, 노골적인, 명확하고 직설적인, 뚜렷이 말한
exploit,개척하다, 개발하다; 착취하다, 공훈, 공적, 위업
exponent,주창자, 옹호자, 지지자, 대표적 인물; (~의)전형, 지침, 모범, 지수
extension,연장; 확장, 연기, 유예, 내선번호, 공여, 제공, 범위, 한도
exterminate,멸종시키다, 박멸하다
extinct,멸종된, 소멸된, 활동을 멈춘; 꺼진
extortion,강요, 강탈; 착취
extract,뽑다, 뽑아내다, 발췌하다, 인용하다, 억지로 얻어내다, 추출하다, 정제, 용액, 추출물
extraneous,비본질적인, 직접적인 관계가 없는, 외래의, 외부에서 오는, 외래종의
extreme,극심한, 극단적인
extricate,구해내다, 빼내어 주다
extrovert,외향적인 사람, 사교적인 사람, 외향적인
exuberant,(활력, 기쁨 등이) 넘쳐흐르는, 충만한, 무성한, 빨리 자라는, 열광적인, 풍부한
fable,우화, 전설, 신화, 꾸며낸 이야기, 지어낸 이야기
fabricate,만들다, 제작하다; 조립하다, 꾸며내다, 위조하다
facet,일면, 국면, 양상, 자른 면
facility,재주, 재능, 재간; 솜씨, 편의, 편리함; 설비, 시설
faint,희미한, 흐릿한, 희박한, 힘없는, 연약한; 내키지 않는, 졸도하다, 기절하다
fairly,꽤, 상당히; 공정하게; 아주, 완전히; 정말로, 사실상
fake,위조하다; 꾸며내다, 날조하다, 속이다, ~인 체하다, 속이다, 사기, 모조품, 가짜의
fallacious,그릇된; 허위의; 논리적 오류가 있는, 사람을 현혹시키는; 믿을 수 없는
fallout,방사능 낙진, 죽음의 재; 강하, 부산물; 부수적 결과; 후유증, 포기자, 낙오자
falter,말을 더듬다, 우물거리다, 비틀거리다, 움찔하다, 뒷걸음치다; 머뭇거리다
famine,식량부족, 기근
fanatic,열광자, 광신자, 마니아, 광적인, 열렬하게 좋아하는
far-fetched,부자연스러운, 억지의, 에두른, 빙 둘러서 말하는
fascinate,매혹하다, 반하게 하다, 황홀하게 하다, 주의를 끌다, 매력이 있다
fastidious,까다로운, 가리는; 꼼꼼한
fathom,헤아리다, 재다; 탐색하다, 두 팔을 벌린 길이, 심도, 깊이; 이해, 통찰
fatuous,얼빠진; 어리석은, 바보 같은
faulty,결점이 있는, 불완전한; 부적절한, 비난할 만한
favor,호의, 친절한 행위; 찬성; 권리, 특권; 편애
feasible,실행할 수 있는; 가능한, 그럴싸한, 있음직한
feeble,연약한, 허약한
feign,~을 가장하다, ~인 체하다
felicity,더할 수 없는 행복; 경사, 길사, 적절함, 교묘함, 적절한 표현, 명문구
ferocious,사나운, 흉포한; 잔인한, 지독한, 굉장한, 맹렬한
fertile,기름진, 비옥한; 다산의, 창의력이 풍부한
fervent,열렬한, 강렬한; (감정 따위가) 격한
fiasco,큰 실수; 대실패
fickle,마음이 잘 변하는, 변덕스러운; 변하기 쉬운
fictitious,거짓의, 허구의, 허위의, 창작적인, 소설적인; 인공의, 상상의
fidelity,충실, 성실, 충성; (부부간의) 정절
fiery,화염의, 불 같은; 얼얼한; 성미가 급한
figurative,비유적인; 상징적인
figurehead,명목상의 두목, 표면상의 대표, 뱃머리에 조각한 얼굴상
firsthand,직젖ㅂ의, 직접 얻은, 직접 구입한, 직접, 바로
flair,천부적인 재능, 재간; 예리한 육감, 경향, 성향
flake,얇은 조각, 박편, 파편; 플레이크, 엷은 조각으로 벗기다
flank,옆구리, 옆구리 살; 측면, ~의 측면에 서다
flatter,아첨하다, 알랑거리다; 추켜세우다, 우쭐해지다, 자만하다
flavor,특징, 특색; 맛, 풍미
flaw,결점, 약점, 결함; 미비한 점, 흠, 돌풍, 질풍; 잠시 동안의 폭풍우
flee,도망하다; 피하다, 사라지다
flippant,경박한, 까불까불한; 경솔한, 무례한
flood,범람시키다, 범람하다; 관개하다
flourish,번창하다, 융성하다, 꽃피다, 장식하다, 꾸며쓰다, 자랑하다
fluctuate,변동하다, 오르내리다, 파동치다; 동요하다; 흔들리다, 동요시키다
flush,홍조를 띠다, 얼굴을 붉히다, 쏟아져나오다, 날아오르다, 홍조, 분출, 흥분, 혈색좋은
folly,어리석은 행동, 바보짓, 어처구니없는 건축
forage,마초, 꼴, 사료; 약탈, 마구 뒤지며 찾다, 뒤지다, 침략하다, 약탈하다
forbear,~을 삼가다; 참다; 억제하다
forbid,금지하다; 허락하지 않다
forebear,조상, 선조
foreboding,예언, 예보; 육감, 예감, 전조, 예감하는
forerunner,선조, 조상; 선구자, 선각자, 전조, 예보
forestall,~을 미리 막다, 기선을 잡다; ~을 앞지르다, 매점하다
forfeit,상실, 박탈, 몰수, 벌금, 과료; 추징금, 상실하다, 몰수당하다
forge,위조하다, 꾸며내다, 단조하다; 만들어내다, 용광로; 대장간, 서서히 나아가다
formative,조형의; 형성되는, 발달의
formidable,가공할, 무서운, 겁나는, 만만치 않은, 어려운
formulate,체계적으로 말하다, 명확히 말하다; 공식화하다
forthcoming,곧 올, 오는, 이번의
forthright,곧게 나아가는; 솔직한, 똑바로 앞으로; 솔직히; 곧, 즉시로
fortify,강화하다, 튼튼히 하다; 오새화하다, 확고히 하다, 확증하다, 독하게 하다
foster,양육하다, 돌보다, 촉진하다, 육성하다, 수양의
foul,더러운, 불결한; 부정한; 나쁜, 음란한, 더럽히다; 더러워지다, 반칙, 파울
founder,실패하다, 침수하여 침몰하다, 허물어지다, 창설자, 재단 설립자
fracture,부러뜨리다; 삐다, 부수다, 파쇄하다, 분열, 골절, 갈라진 곳(틈)
fragile,부서지기 쉬운, 무른, 허약한, 덧없는
fraud,사기, 기만, 가짜; 사기꾼
freak,정신을 못 차리게 하다; 흥분시키다, 얼룩지게 하다, 기형, 변종, 장난, 얼룩, 마약상용자
frenzied,열광적인; 광포한
frequent,자주 일어나는, 빈번한; 상습적인, 자주 가다, 자주 출입하다
frill,사치; 불필요한 것, 겉치레, 뽐냄, 우쭐거림; 점잔빼는 태도, 주름 장식, 테두리 장식
frivolous,천박한, 경박한, 경솔한, 사소한, 하찮은
frugal,절약하는, 간소한, 소박한; 검소한
fruitful,결실이 많은; 비옥한; 수익이 많은
fuel,연료를 보급하다; 지지하다; 자극하다
fugitive,도망자, 탈주자, 망명자, 도망하는, 망명의, 덧없는, 일시적인, 정처없는
fulfill,이행하다, 실행하다, 성취하다; 만족시키다
full,완전한; 최고조의, 한창때인; 상세한
full-blown,만발한, 무르익은
furious,성내어 날뛰는, 격노한, 맹렬한, 왕성한, 사나운, 격렬한
furnish,공급하다, 제공하다
furthermore,더욱이, 게다가
furtive,몰래 하는, 남의 눈을 속이는, 은밀한, 수상쩍은; 믿을 수 없는
futile,효과없는; 무익한, 시시한, 변변찮은
gainful,벌이가 되는, 수지 맞는, 유급의
galling,짜증나게 하는, 화나는, 분통이 터지는
galvanize,기운이 나게 하다; 격려하여 ~하게 하다, 직류 전기로 자극하다, 자극을 받다, 힘이 나다
gape,놀라서 입을 딱 벌리다; 하품하다, 입을 떡 벌림; 벌어진 틈; 하품
garrulous,말 많은, 수다스러운, 장황한, 시끄럽게 지저귀는
gasp,헐떡거리다, 숨이 막히다; 열망하다, 헐떡거림, 숨막힘
gelatinous,아교질의; 젤라틸으로 된
gem,보석; 보석처럼 귀중한 것
generalize,특정 사실에서 법칙을 이끌어내다, 일반화하다, 귀납하다
genocide,특정 인종, 민족에 대한 계획적, 조직적인 집단 학살
genuine,진짜의, 진품의, 서일한, 진심의, 순수한, 순종의
germane,밀접한 관계가 있는, 적절한, 혈연 관계인
gestation,임신, 잉태, 숙성기간, 임신 기간, 형성
giddy,현기증나는, 어지러운; 아찔한, 들떠 있는, 현기증이 나(게 하)다
gingerly,몹시 조심스럽게, 신중하게, 몹시 조심스러운, 아주 신중한, 주의 깊은
gist,요점, 요지, 골자, 주요 소인
glide,미끄러지다, 활공하다
glimpse,흘끗 봄, 일견, 일별, 희미하게 보임; 어렴풋이 감지함, 얼핏 보다; 희미하게 보이다
gloat,고소한 듯이 바라보다, 남몰래 기뻐하다, 고소해함
gloomy,우울한, 침울한, 울적한, 음침한, 비관적인, 암담한
gradual,점차적인, 점진적인, 단계적인
grandeur,웅장, 장대
grasp,붙잡다, 움켜잡다
gratification,만족, 희열; 만족시키는 것
greed,대식, 폭식, 탐욕, 큰 욕심
gregarious,사교적인, 집단을 좋아하는, 떼지어 사는, 군거성의
